Price,Address,Squares,Rooms,Floor
1.000 €,"Opština Vračar, Hram svetog Save, Šumatovačka",72 m2,3.0,III/6
680 €,"Opština Zvezdara, Bulevar kralja Aleksandra, ",64 m2,3.0,I/7
550 €,"Opština Zvezdara, Kluz, Bulevar Kralja aleksandra - Braće Amar",50 m2,2.0,PR/1
550 €,"Opština Voždovac, Saobraćajni fakultet, Vojvode Stepe 312",31 m2,1.0,IX/12
1.100 €,"Opština Voždovac, Naselje Stepa Stepanović, Vojvode Stepe",83 m2,3.0,IV/7
2.000 €,"Opština Savski venac, Centar, Svetozara Markovića",185 m2,5+,III/8
400 €,"Opština Zvezdara, Mali Mokri Lug, Stevana Mokranjca",40 m2,1.5,I
1.000 €,"Opština Vračar, Hram svetog Save, Katanićeva",85 m2,3.0,II/6
350 €,"Opština Zemun, Gornji grad, Alaska",30 m2,1.5,VPR/5
550 €,"Opština Zvezdara, Mirijevo, Grge Jankesa",42 m2,1.5,III/8
580 €,"Opština Zemun, Marija Bursać, Marije Bursać",69 m2,3.0,VIII/12
700 €,"Opština Vračar, Bulevar kralja Aleksandra, Golsvordijeva",44 m2,1.5,V/6
550 €,"Opština Voždovac, Dušanovac, Danijelova",40 m2,2.0,III/5
350 €,"Opština Surčin, Surčin (mesto), Danila Kiša",51 m2,2.5,III/3
600 €,"Opština Novi Beograd, Blok 63, Gandijeva",42 m2,1.5,V/10
380 €,"Opština Voždovac, Voždovačka crkva, Bjelovarska",36 m2,1.0,PR/2
750 €,"Opština Stari grad, Skadarlija, Cetinjska",45 m2,2.0,III/5
350 €,"Opština Palilula, Karaburma, Mirijevski bulevar",49 m2,1.0,III/5
700 €,"Opština Zvezdara, Slavujev venac, Stjepana Ljubiše",53 m2,2.0,IV/5
450 €,"Opština Stari grad, Atelje 212, Svetogorska",32 m2,1.0,VPR/4
1.000 €,"Opština Vračar, Slavija, Kneginje Zorke",47 m2,2.0,IV/5
320 €,"Opština Zemun, Altina, Pavla Vujisića",40 m2,2.5,II/3
1.200 €,"Opština Stari grad, Trg Republike, Dositejeva",120 m2,4.0,I/6
5.000 €,"Opština Savski venac, Dedinje, Neznanog junaka",213 m2,4.0,II/4
400 €,"Opština Zvezdara, Vojvode Vlahovića, Miljana Miljanića",37 m2,2.0,III/3
5.000 €,"Opština Savski venac, Beograd na vodi, Luke Ćelovića Trebinjca",200 m2,5+,XI/11
400 €,"Opština Rakovica, Petlovo brdo, Nićifora Ninkovića",45 m2,2.0,N/A
600 €,"Opština Savski venac, Stadion Partizana, Ljutice Bogdana",55 m2,2.0,I/14
4.300 €,"Opština Savski venac, Dedinje, Heroja Milana Tepića",245 m2,5.0,III
550 €,"Opština Čukarica, Banovo brdo, Požeška",50 m2,2.0,I/5
650 €,"Opština Savski venac, Zeleni venac, Crnogorska",40 m2,1.5,V/6
1.200 €,"Opština Vračar, Hram svetog Save, Katanićeva",85 m2,3.0,II/6
600 €,"Opština Stari grad, Dorćol, Cara Dušana",40 m2,2.0,III/12
750 €,"Opština Zvezdara, Učiteljsko naselje, Kozarčeva",60 m2,3.0,PR/3
1.200 €,"Opština Novi Beograd, Sava centar, Vladimira Popovića",98 m2,3.0,II/7
2.000 €,"Opština Savski venac, Beograd na vodi, ","112,63 m2",4.0,XIII/23
600 €,"Opština Novi Beograd, Blok 70a, Omladinskih brigada",60 m2,2.0,VI
450 €,"Opština Stari grad, Centar, Džordža Vašingtona",25 m2,0.5,II/5
650 €,"Opština Vračar, Južni bulevar, Generala Horvatovića",37 m2,1.5,VPR
500 €,"Opština Palilula, Višnjička Banja, Mirka Milojkovića",45 m2,2.0,III/7
350 €,"Opština Čukarica, Žarkovo, Šavnička",48 m2,1.5,VPR/5
650 €,"Opština Zemun, Zelena avenija, Trogirska",38 m2,2.0,III/7
300 €,"Opština Rakovica, Petlovo brdo, Đuje i Dragoljuba",40 m2,1.5,IV/4
650 €,"Opština Palilula, 27. marta, Karnedžijeva7",47 m2,1.0,IX/12
450 €,"Opština Zvezdara, Mirijevo, Rudi Čajaveca",44 m2,1.5,I/4
1.400 €,"Opština Vračar, Čubura, Čuburska",113 m2,4.0,II
350 €,"Opština Palilula, Cvijićeva, Cvijićeva",26 m2,0.5,V/5
400 €,"Opština Vračar, Hram svetog Save, Mutapova",30 m2,0.5,VPR/5
2.000 €,"Opština Stari grad, K-District, Bulevar vojvode Bojovića",75 m2,3.0,IV/8
350 €,"Opština Stari grad, Dorćol, Džordža Vašingtona",15 m2,1.0,IV/5
600 €,"Opština Palilula, 27. marta, Miročka",50 m2,2.0,I/7
450 €,"Opština Palilula, Karaburma, Husinskih rudara",61 m2,3.0,III/5
440 €,"Opština Čukarica, Žarkovo, Ace Joksimovića",50 m2,2.0,III/3
350 €,"Opština Palilula, Krnjača, Partizanski blok ulica 2.",33 m2,1.5,II/3
450 €,"Opština Zvezdara, Dimitrija Tucovića, Primorska",45 m2,2.0,II/4
450 €,"Opština Vračar, Crveni krst, Vojislava Ilića",34 m2,1.5,VII/7
700 €,"Opština Zvezdara, Cvetkova pijaca, Živka Davidovića",47 m2,2.0,I/5
500 €,"Opština Zvezdara, Cvetkova pijaca, Ljube Davidovića",40 m2,2.0,I/3
550 €,"Opština Čukarica, Žarkovo, Vodovodska",79 m2,3.0,II
750 €,"Opština Novi Beograd, Blok 67 (Belvil), Jurija Gagarina",45 m2,2.0,IX
550 €,"Opština Voždovac, Bioskop Voždovac, Vojvode Stepe",47 m2,2.0,II
1.500 €,"Opština Voždovac, Autokomanda, Esad Pašina",100 m2,4.0,VPR/3
500 €,"Opština Zvezdara, Učiteljsko naselje, Kozarčeva",27 m2,2.0,I/2
1.200 €,"Opština Vračar, Južni bulevar, Kneza Stracimira",60 m2,3.0,IV/7
380 €,"Opština Rakovica, Centar, Kraljice Jelene",31 m2,1.0,II/3
450 €,"Opština Vračar, Kalenić pijaca, Molerova",36 m2,1.5,SUT/3
200 €,"Opština Rakovica, Kneževac, Kneževačka",44 m2,1.0,I/1
320 €,"Opština Palilula, Karaburma, Salvadora Aljendea",43 m2,1.0,I/5
500 €,"Opština Voždovac, Kumodraž, Decembarska",68 m2,2.0,I/1
450 €,"Opština Stari grad, Dorćol, Solunska",32 m2,1.0,III/6
400 €,"Opština Zemun, Muhar, Dunavska",36 m2,1.5,I/3
900 €,"Opština Vračar, Kalenić pijaca, Novopazarska",64 m2,2.5,V/6
280 €,"Opština Zvezdara, Mirijevo, nade puric",35 m2,1.0,N/A
750 €,"Opština Savski venac, Dedinje, Slavka Ćuruvije",75 m2,3.0,I/2
400 €,"Opština Palilula, Krnjača, Partizanski blok ulica 2.",60 m2,3.0,III/3
400 €,"Opština Čukarica, Filmski grad, Nebojše Đukelića",46 m2,2.0,IV/4
950 €,"Opština Savski venac, Resavska, Resavska",68 m2,2.5,I/6
700 €,"Opština Voždovac, Saobraćajni fakultet, Vojvode Stepe",90 m2,3.5,V/6
370 €,"Opština Voždovac, Medaković 2, Rastko Petrovića 47",26 m2,1.5,VPR
600 €,"Opština Palilula, Hala Pionir, Dragoslava Srejovića",55 m2,2.0,IV/11
600 €,"Opština Palilula, Cvijićeva, Cvijićeva",47 m2,2.0,VI/14
600 €,"Opština Zemun, Galenika, Dunavskih virova",70 m2,3.0,II/6
800 €,"Opština Zemun, Gornji grad, Dobanovačka",60 m2,3.0,III/6
600 €,"Opština Novi Beograd, Blok 45 (TC Enjub), Jurija Gagarina",54 m2,1.5,I/1
500 €,"Opština Zvezdara, Konjarnik, Glasinačka",41 m2,1.5,IV/9
450 €,"Opština Zvezdara, Vukov Spomenik, Zahumska",42 m2,1.5,VPR/4
300 €,"Opština Zvezdara, Konjarnik, Rudo",23 m2,0.5,VPR/27
1.000 €,"Opština Palilula, Hala Pionir, Dragoslava Srejovića",72 m2,3.5,IV/10
1.200 €,"Opština Savski venac, Resavska, Resavska",68 m2,3.5,VI/7
330 €,"Opština Zemun, Autoput za Novi Sad, Ugrinovacki put",25 m2,0.5,PR/5
500 €,"Opština Vračar, Neimar, Sime Igumanova",41 m2,1.5,IV/6
450 €,"Opština Savski venac, Savski trg - Pristanište, Kneza Miloša",38 m2,1.5,PSUT/6
400 €,"Opština Palilula, Tašmajdan, 27. marta",38 m2,2.0,V/5
750 €,"Opština Zvezdara, Cvetkova pijaca, Vjekoslava Kovača",56 m2,2.0,II/2
350 €,"Opština Čukarica, Žarkovo, Repiška",48 m2,2.0,I/3
550 €,"Opština Voždovac, Voždovačka crkva, Vojvode Stepe",56 m2,2.0,V/7
1.350 €,"Opština Voždovac, Vojvode Stepe, Kostolačka",116 m2,4.0,IV/6
450 €,"Opština Vračar, Čubura, Daničareva",36 m2,1.5,I/2
550 €,"Opština Stari grad, Dorćol, Cara Dušana",35 m2,1.0,II/7
330 €,"Opština Zemun, Galenika, Lazara Mamuzića",36 m2,1.5,I/2
400 €,"Opština Zemun, Save Kovačevića, Save Burića",55 m2,2.5,III
1.350 €,"Opština Vračar, Kalenić pijaca, Kičevska",100 m2,4.0,IV/6
1.500 €,"Opština Vračar, Krunski venac, Kumanovska",106 m2,4.0,I/5
600 €,"Opština Savski venac, Dedinje, Boška Petrovića",58 m2,2.0,I/4
150 €,"Opština Zemun, Kolonija Zmaj, Dušana Janićijevića",35 m2,0.5,PR/1
2.300 €,"Opština Stari grad, Centar, Makedonska",150 m2,5+,II/4
360 €,"Opština Zvezdara, Mirijevo, Dva bela goluba",34 m2,1.0,IV/5
690 €,"Opština Novi Beograd, Hotel Jugoslavija, Bulevar maršala Tolbuhina",70 m2,3.0,V/9
600 €,"Opština Zemun, Centar, Marka Nikolića",55 m2,2.0,I/4
300 €,"Opština Rakovica, Kneževac, Prvoboraca",32 m2,1.5,PR/4
450 €,"Opština Surčin, Ledine, Benkovačka",50 m2,2.0,I
450 €,"Opština Zemun, Centar, Kosovska",32 m2,2.0,IV/4
500 €,"Opština Grocka, Kaluđerica, Svetozara Markovića",60 m2,3.0,III/3
550 €,"Opština Palilula, Profesorska kolonija, Čarlija Čaplina",36 m2,1.5,VPR/6
650 €,"Opština Palilula, Karaburma, Milorada Dimitrijevića",59 m2,3.0,VII/7
350 €,"Opština Zvezdara, Zeleno brdo, Ilindenska","36,50 m2",1.5,SUT/6
500 €,"Opština Zvezdara, Učiteljsko naselje, Mis Irbijeve",53 m2,2.0,VPR/4
700 €,"Opština Zvezdara, Lion, Ulcinjska",98 m2,2.0,VI/6
400 €,"Opština Voždovac, Braće Jerković, Nade Naumović",37 m2,1.5,II
900 €,"Opština Stari grad, Dorćol, Mike Alasa",61 m2,2.0,I/8
250 €,"Opština Grocka, Kaluđerica, Dušana Kostića 6",55 m2,2.0,I/1
450 €,"Opština Voždovac, Lekino brdo, Todora Dukina",55 m2,2.0,I/2
650 €,"Opština Zvezdara, Bulbulder, Dimitrija Tucovica 117",50 m2,2.5,IV/6
700 €,"Opština Palilula, Poštanska štedionica, Dalmatinska",65 m2,3.0,II/4
1.000 €,"Opština Vračar, Južni bulevar, Gospodara Vučića",50 m2,2.0,III/4
950 €,"Opština Čukarica, Banovo brdo, Vase Stajića",60 m2,2.0,VI/6
500 €,"Opština Zvezdara, Mirijevo, Kapetana Miloša Žunjića",45 m2,1.5,III/3
250 €,"Opština Palilula, Krnjača, Zrenjaninski put",23 m2,1.0,IV/5
380 €,"Opština Palilula, Krnjača, Zrenjaninski put",40 m2,1.5,V/5
490 €,"Opština Vračar, Crveni krst, Gročanska",30 m2,1.0,VPR/5
1.250 €,"Opština Zvezdara, Bulbulder, Varovnička",165 m2,5+,II
500 €,"Opština Zvezdara, Lion, Silvija Kranjčevića",65 m2,2.0,VPR
800 €,"Opština Vračar, Crveni krst, Grčića Milenka",75 m2,3.0,XIII
690 €,"Opština Savski venac, Gavrila Principa, Gavrila Principa",63 m2,3.0,I/3
350 €,"Opština Savski venac, Humska, Oblakovska",30 m2,0.5,I/3
290 €,"Opština Vračar, Južni bulevar, Cerska",24 m2,1.0,N/A
3.000 €,"Opština Vračar, Hram svetog Save, Šumatovačka",231 m2,5+,IV/5
450 €,"Opština Stari grad, Centar, Venizelosova",25 m2,1.0,III/4
1.100 €,"Opština Palilula, Dalmatinska, Dalmatinska",58 m2,2.0,VI/7
430 €,"Opština Čukarica, Bele vode, Lazara Komarčića",58 m2,2.0,II/2
250 €,"Opština Zvezdara, Mirijevo, Aleksandra Belića",33 m2,1.0,IV/5
500 €,"Opština Voždovac, TC Stadion, Braće Jerković",60 m2,3.0,VPR/4
450 €,"Opština Zvezdara, Cvetkova pijaca, Vjekoslava Kovača",34 m2,2.0,VPR
350 €,"Opština Voždovac, Braće Jerković, Dragice Končar",37 m2,2.0,V/5
1.200 €,"Opština Stari grad, Dorćol, Gospodar Jovanova",100 m2,4.0,VPR/5
350 €,"Opština Zvezdara, Lion, Madridska",30 m2,1.0,I/5
380 €,"Opština Palilula, Karaburma, Danteova",40 m2,1.5,I/5
380 €,"Opština Zvezdara, Zvezdarska padina, Dukatska",60 m2,2.5,III/4
400 €,"Opština Zemun, Novi grad, Železnička",27 m2,1.5,II/4
400 €,"Opština Palilula, Centar, Cvijićeva",38 m2,1.0,V/5
900 €,"Opština Zvezdara, Severni bulevar, Zvezdarskih jelki",78 m2,3.0,I/3
1.300 €,"Opština Savski venac, Dedinje, Sime Lozanića",65 m2,3.0,III/4
1.000 €,"Opština Stari grad, K-District",49 m2,2.0,IV
1.500 €,"Opština Stari grad, Dom omladine, Dečanska",116 m2,4.0,IV/7
1.500 €,"Opština Novi Beograd, Blok 68, Jurija Gagarina",113 m2,4.0,VI/9
320 €,"Opština Palilula, Mašinski fakultet, Kraljice Marije",20 m2,0.5,PR/1
350 €,"Opština Rakovica, Stari Košutnjak, Pere Velimirovića",50 m2,2.0,II/3
450 €,"Opština Palilula, Karaburma, Juhorska",35 m2,1.5,III/5
350 €,"Opština Čukarica, Žarkovo, Milana Jovanovića",40 m2,1.5,VPR/8
500 €,"Opština Rakovica, Kanarevo brdo, Vukasovićeva",58 m2,2.5,PR/5
2.500 €,"Opština Stari grad, Skupština, Svetogorska",135 m2,4.0,II/5
950 €,"Opština Novi Beograd, Blok 65, Omladinskih brigada",40 m2,1.0,V/15
650 €,"Opština Voždovac, Vitanovačka, 9 Petrovačka",46 m2,2.0,I/3
550 €,"Opština Novi Beograd, Blok 28, Bulevar Milutina Milankovića",28 m2,0.5,X/16
320 €,"Opština Voždovac, Vojvode Vlahovića, Miljana Miljanića 16",26 m2,1.0,IV/5
420 €,"Opština Voždovac, Medaković 3, Braće Srnić",32 m2,1.5,N/A
200 €,"Opština Stari grad, Centar, Džordža Vašingtona",12 m2,0.5,III/4
300 €,"Opština Čukarica, Žarkovo, Vodovodska",27 m2,1.0,III/3
350 €,"Opština Zemun, Kolonija Zmaj, Božidara Savićevića",40 m2,2.0,I/1
1.000 €,"Opština Vračar, Crveni krst, Dravska",75 m2,2.5,V/8
500 €,"Opština Voždovac, Kumodraška, Stevana Jakovljevića",50 m2,2.5,VPR/4
280 €,"Opština Palilula, Borča, JNA",40 m2,2.0,VPR
320 €,"Opština Zvezdara, Mirijevo, Mihaila Bulgakova",45 m2,1.5,IV/4
1.600 €,"Opština Vračar, Hram svetog Save, Podgorička",110 m2,4.0,IV/5
450 €,"Opština Zemun, Centar, Sevina",46 m2,2.0,II/4
450 €,"Opština Voždovac, TC Stadion, Medakovićeva",50 m2,1.5,PR/1
350 €,"Opština Čukarica, Banovo brdo, Valjevska",28 m2,1.0,PR/5
600 €,"Opština Vračar, Hram svetog Save, Nikolaja Krasnova",56 m2,2.0,I/5
400 €,"Opština Voždovac, Siva stena, Miloša Svetića",48 m2,2.0,PR/2
2.500 €,"Opština Vračar, Hram svetog Save, Patrijarha Varnave",203 m2,5+,III/4
350 €,"Opština Stari grad, Bajlonijeva pijaca, Žorža Klemansoa",17 m2,1.0,III/5
600 €,"Opština Zemun, Kalvarija, Marije Bursać",46 m2,2.0,VI/8
1.350 €,"Opština Novi Beograd, Blok 33, Bulevar Arsenija Čarnojevića",122 m2,5.0,II/4
650 €,"Opština Zvezdara, Gradska bolnica, Preševska",80 m2,3.0,V
1.200 €,"Opština Stari grad, Dorćol, Žorža Klemansoa",86 m2,3.0,VPR/3
550 €,"Opština Savski venac, Sajam, Koste Glavinića",38 m2,2.5,I/4
850 €,"Opština Stari grad, Dorćol, Pjarona de Mondezira",65 m2,2.0,I/4
250 €,"Opština Palilula, Višnjička Banja, Zore Drempetić",25 m2,1.5,PR/4
650 €,"Opština Stari grad, Centar, Studentski Trg",35 m2,1.5,VI/7
2.000 €,"Opština Novi Beograd, YUBC, Bulevar Mihajla Pupina",126 m2,3.0,V/5
550 €,"Opština Palilula, Višnjička Banja, Slanački put",46 m2,2.0,I/5
1.200 €,"Opština Palilula, Poštanska štedionica, Stanoja Glavaša",63 m2,2.0,VI
850 €,"Opština Stari grad, K-District, Bulevar vojvode Bojovića 4a",46 m2,2.0,I/7
1.450 €,"Opština Savski venac, Beograd na vodi, Nikolaja Kravcova","65,75 m2",2.0,PR/8
900 €,"Opština Vračar, Kalenić pijaca, Ivana Đaje",67 m2,3.0,II/4
450 €,"Opština Zemun, Save Kovačevića, Blagoja Jovovića",64 m2,2.0,I/4
500 €,"Opština Vračar, Hram svetog Save, Dubljanska",42 m2,2.0,PR/1
800 €,"Opština Zvezdara, Đeram pijaca, Preševska",53 m2,2.5,I/6
600 €,"Opština Vračar, Crveni krst, Hadži Đerina",40 m2,1.0,VPR/5
450 €,"Opština Zvezdara, Mirijevo, Mihaila Bulgakova",55 m2,1.5,III/3
650 €,"Opština Savski venac, Ekonomski fakultet, Gavrila Principa",50 m2,1.5,III/4
700 €,"Opština Vračar, Čubura, Cerska",45 m2,2.0,II/4
400 €,"Opština Surčin, Surčin (mesto), Stanislava Biničkog",85 m2,4.0,I
1.000 €,"Opština Vračar, Slavija, Kralja Milutina 33",54 m2,2.0,II
400 €,"Opština Zemun, Save Kovačevića, Crnogorska",30 m2,0.5,II/3
550 €,"Opština Zvezdara, Lion, Bulevar kralja Aleksandra",56 m2,2.0,I/5
480 €,"Opština Čukarica, Banovo brdo, Požeška",52 m2,2.0,II/4
1.100 €,"Opština Stari grad, Terazije, Nušićeva",45 m2,2.0,V/6
850 €,"Opština Zvezdara, Lion, Ravanička",49 m2,2.5,I/5
2.000 €,"Opština Vračar, Krunski venac, Krunska",120 m2,5+,VPR/4
2.800 €,"Opština Savski venac, Beograd na vodi, Luke Ćelovića Trebinjca",53 m2,2.0,PR/10
990 €,"Opština Vračar, Slavija, Svetozara Markovića",60 m2,2.0,III/6
400 €,"Opština Zvezdara, Učiteljsko naselje, Mis Irbijeve",30 m2,1.0,I/2
600 €,"Opština Zvezdara, Cvetkova pijaca, Živka Davidovića",60 m2,3.0,PR/3
2.600 €,"Opština Savski venac, Dedinje, Miloja Đaka",140 m2,4.0,I/3
700 €,"Opština Novi Beograd, Blok 67 (Belvil), Jurija Gagarina",68 m2,2.0,II/10
400 €,"Opština Zvezdara, Đeram pijaca, Đuke Dinić",41 m2,2.0,PR/3
2.300 €,"Opština Vračar, Krunska","128,97 m2",4.0,N/A
650 €,"Opština Novi Beograd, Blok 44 (TC Piramida), Gandijeva",50 m2,2.0,I/4
450 €,"Opština Savski venac, Klinički centar, Tiršova",40 m2,1.5,VII/8
2.500 €,"Opština Stari grad, Centar",85 m2,3.0,IV
2.000 €,"Opština Vračar, Hram svetog Save",100 m2,3.0,N/A
700 €,"Opština Voždovac, Vojvode Stepe, Otokara Keršovanija",48 m2,2.0,IV/8
700 €,"Opština Vračar, Slavija, Makenzijeva",65 m2,2.0,I/6
250 €,"Opština Grocka, Kaluđerica, Kralja Petra I",25 m2,0.5,PR/5
1.500 €,"Opština Stari grad, Obilićev venac, Đure Jakšića",100 m2,3.0,VPR/5
350 €,"Opština Novi Beograd, Blok 9a, Džona Kenedija",33 m2,1.0,VIII/9
1.400 €,"Opština Stari grad, Dorćol, Venizelosova",65 m2,2.0,II/8
2.700 €,"Opština Savski venac, Dedinje, Heroja Milana Tepića",100 m2,3.0,III/5
750 €,"Opština Vračar, Južni bulevar, Kneza Stracimira",50 m2,2.0,III/5
950 €,"Opština Vračar, Krunska, Desanke Maksimović",82 m2,3.0,II/5
550 €,"Opština Stari grad, Dorćol, Mike Alasa",45 m2,1.5,PR/6
300 €,"Opština Zvezdara, Mirijevo, Kapetana Miloša Žunjića",30 m2,1.0,I/4
1.600 €,"Opština Stari grad, Dorćol",89 m2,3.0,V/6
800 €,"Opština Stari grad, Centar, Dragoslava Jovanovića",54 m2,2.0,III/3
700 €,"Opština Stari grad, Centar, Dragoslava Jovanovića",59 m2,2.0,II/3
250 €,"Opština Palilula, Krnjača, Grge Andrijanovića ulica 2.",35 m2,1.0,PR
600 €,"Opština Vračar, Čubura, Černiševskog",47 m2,2.0,III/4
500 €,"Opština Stari grad, Dorćol, Šantićeva",35 m2,1.5,VII
550 €,"Opština Palilula, Karaburma, Patrisa Lumumbe",70 m2,3.5,I
350 €,"Opština Palilula, Ćalije, Jovanke Radaković",29 m2,0.5,I/4
1.200 €,"Opština Vračar, Crveni krst, Kajmakčalanska",85 m2,3.0,IV
1.500 €,"Opština Vračar, Hram svetog Save, Internacionalnih brigada",200 m2,5+,VI
1.200 €,"Opština Stari grad, Dorćol, Pjarona de Mondezira",75 m2,3.0,III
600 €,"Opština Zemun, Galenika, Prvomajska",50 m2,3.0,III/5
400 €,"Opština Zvezdara, Kluz, Keltska",30 m2,1.0,II/3
1.600 €,"Opština Savski venac, Centar, Sarajevska",61 m2,2.0,III/7
400 €,"Opština Palilula, Bogoslovija, Generala Aračića",40 m2,2.0,I/3
430 €,"Opština Stari grad, Francuska, Skenderbegova",43 m2,1.5,PR/4
700 €,"Opština Vračar, Hram svetog Save, Internacionalnih brigada",44 m2,1.5,IV/6
700 €,"Opština Savski venac, Dedinje, Teodora Drajzera",55 m2,2.0,I/1
1.350 €,"Opština Vračar, Krunski venac, Kičevska",117 m2,4.0,IV/6
800 €,"Opština Voždovac, Trošarina, Save Maškovića",51 m2,2.0,VII/8
500 €,"Opština Voždovac, Vojvode Stepe, Nikšićka",37 m2,2.0,II/3
250 €,"Opština Zvezdara, Bulevar kralja Aleksandra, Bulevar kralja Aleksandra",20 m2,1.0,I/2
1.300 €,"Opština Vračar, Kalenić pijaca",75 m2,2.0,I/5
900 €,"Opština Novi Beograd, Blok 67 (Belvil)",63 m2,2.0,V
400 €,"Opština Zvezdara, Cvetanova ćuprija, Krivošijska",42 m2,1.5,II/4
400 €,"Opština Voždovac, Braće Jerković, Kneza Bogosava",37 m2,2.0,PR/1
350 €,"Opština Zvezdara, Medaković 3, Cvetanova Ćuprija 18",28 m2,1.0,PR/3
1.200 €,"Opština Savski venac, Senjak, Puškinova",75 m2,1.5,II/2
300 €,"Opština Palilula, Višnjička Banja, Višnjička",48 m2,3.0,II/2
600 €,"Opština Savski venac, Centar, Svetozara Markovića",44 m2,1.5,VPR/5
1.600 €,"Opština Novi Beograd, Blok 65, Omladinskih brigada",59 m2,2.0,N/A
500 €,"Opština Zemun, Altina, Ugrinovački put 49",55 m2,3.0,PR/4
250 €,"Opština Palilula, Karaburma, Ćustendilska",20 m2,0.5,II
450 €,"Opština Čukarica, Banovo brdo, Paštrovićeva",31 m2,1.0,I/7
230 €,"Opština Zemun, Vojni put, Božidarčeva",30 m2,1.0,PR/1
600 €,"Opština Palilula, 27. marta, Kraljice Marije",45 m2,2.0,II/8
2.000 €,"Opština Zvezdara, Đeram pijaca, Gajeva",204 m2,4.0,IV/5
500 €,"Opština Surčin, Surčin (mesto), Vojvođanska",75 m2,3.0,N/A
400 €,"Opština Vračar, Kalenić pijaca, Trnska",21 m2,0.5,II/4
550 €,"Opština Voždovac, Voždovačka crkva, Vitanovačka",50 m2,2.0,IV/7
1.550 €,"Opština Čukarica, Cerak, Slavonskih brigada",120 m2,4.5,II/3
1.800 €,"Opština Stari grad, Politika, Hilandarska",118 m2,3.0,II/6
500 €,"Opština Stari grad, Skupština, Palmotićeva",45 m2,2.0,VI/6
1.100 €,"Opština Zemun, Retenzija, Džona Kenedija",92 m2,3.0,V/7
850 €,"Opština Zvezdara, Crveni krst, Golubačka",74 m2,3.0,IV/4
600 €,"Opština Zemun, Pregrevica, Slavonska",45 m2,1.5,I/3
650 €,"Opština Palilula, Profesorska kolonija, Cvijićeva",40 m2,2.0,VII/13
550 €,"Opština Stari grad, Skadarlija, Zetska",30 m2,1.0,II/2
1.200 €,"Opština Savski venac, Beograd na vodi",53 m2,2.0,VII/19
500 €,"Opština Palilula, Centar, Bulevar despota Stefana",37 m2,1.5,I/5
380 €,"Opština Zemun, Centar, Vrtlarska",22 m2,1.0,IV/4
850 €,"Opština Palilula, Karaburma, Big Residences",48 m2,2.0,III/8
1.300 €,"Opština Vračar, Hram svetog Save",63 m2,2.5,I/5
900 €,"Opština Palilula, Centar",63 m2,2.0,I/7
750 €,"Opština Vračar, Hram svetog Save",50 m2,2.0,PR/5
1.000 €,"Opština Savski venac, Dedinje",65 m2,2.0,PR/5
1.000 €,"Opština Vračar, Kalenić pijaca, Grahovska",80 m2,3.0,III/3
600 €,"Opština Vračar, Hram svetog Save, Mihaila Gavrilovića",40 m2,1.0,II/8
1.000 €,"Opština Novi Beograd, Blok 21, Bulevar Zorana Đinđića",65 m2,3.0,PR/5
1.500 €,"Opština Stari grad, Dorćol, Gospodar Jovanova",58 m2,2.0,VPR/5
380 €,"Opština Rakovica, Miljakovac, Srpskih serdara",42 m2,1.5,IV/4
350 €,"Opština Obrenovac, Obrenovac (mesto), Đačkog bataljona",44 m2,2.0,PR/3
700 €,"Opština Zemun, Centar, Magistratski trg",36 m2,1.5,IV/4
300 €,"Opština Zvezdara, Konjarnik, Ustanička",23 m2,0.5,V/7
400 €,"Opština Voždovac, Trošarina, Vojvode Stepe 343",40 m2,2.5,VI/8
360 €,"Opština Rakovica, Miljakovac, Vukasovićeva",38 m2,2.0,IV/4
700 €,"Opština Novi Beograd, Blok 67a (A blok), Uroša Martinovića",34 m2,1.0,III/8
250 €,"Opština Zvezdara, Veliki Mokri Lug, Vladimira Ćorovića",35 m2,1.0,N/A
350 €,"Opština Rakovica, Labudovo brdo, Sretena Mladenovića Mike",65 m2,2.0,III/5
2.200 €,"Opština Novi Beograd, Blok 65, Tadije Sondermajera",118 m2,4.0,VII
1.000 €,"Opština Voždovac, Vojvode Stepe, Vojvode Stepe",56 m2,2.0,II/12
400 €,"Opština Stari grad, Dorćol, Carigradska",22 m2,1.0,VPR/4
1.000 €,"Opština Savski venac, Sarajevska, Sarajevska",57 m2,2.0,X/11
1.000 €,"Opština Novi Beograd, Arena, Antifašističke borbe",87 m2,4.0,V/7
2.700 €,"Opština Vračar, Kalenić pijaca",140 m2,4.0,N/A
1.600 €,"Opština Savski venac, Beograd na vodi",72 m2,3.0,VII
400 €,"Opština Čukarica, Žarkovo, Braće Limijer",42 m2,1.5,II/5
500 €,"Opština Novi Beograd, Tošin bunar, Tošin bunar",62 m2,2.0,I/6
800 €,"Opština Novi Beograd, Blok 64, Gandijeva",84 m2,3.0,XI/13
490 €,"Opština Savski venac, Palata pravde, Dr Aleksandra Kostića",50 m2,2.0,I/5
450 €,"Opština Vračar, Krunska, Krunska",30 m2,1.0,VPR
550 €,"Opština Vračar, Maksima Gorkog, Tetovska",45 m2,2.0,I/3
500 €,"Opština Palilula, Karaburma, Ane Frank",56 m2,2.0,IV
700 €,"Opština Novi Beograd, Blok 22, Antifašističke borbe",61 m2,2.0,VI
280 €,"Opština Palilula, Karaburma, Prominska",22 m2,0.5,I/4
1.500 €,"Opština Novi Beograd, Blok 32 (Crkva svetog Dimitrija), ",72 m2,2.5,III/6
400 €,"Opština Zvezdara, Bulevar kralja Aleksandra, Živka Davidovića",38 m2,1.0,PSUT
630 €,"Opština Vračar, Hram svetog Save, Dubljanska",60 m2,3.0,PR/5
370 €,"Opština Voždovac, Dušanovac, Vojvode Đurovića",34 m2,0.5,PR/4
400 €,"Opština Zvezdara, Mirijevo, Grge Jankesa",42 m2,1.5,II/3
450 €,"Opština Vračar, Crveni krst, Jovana Rajića 3",29 m2,0.5,I/7
300 €,"Opština Čukarica, Bele vode, Braće Vučković",25 m2,0.5,II/4
650 €,"Opština Palilula, Višnjička Banja, Mirka Milojkovića",67 m2,3.0,II/5
240 €,"Opština Rakovica, Kanarevo brdo, Petra Konjovića",33 m2,1.0,PR/4
2.500 €,"Opština Vračar, Hram svetog Save, ",180 m2,4.0,IV/6
1.050 €,"Opština Savski venac, Zeleni venac, Svetozara Radića",84 m2,3.0,III/5
1.700 €,"Opština Savski venac, Beograd na vodi, Hercegovačka",110 m2,4.0,XII/17
1.000 €,"Opština Stari grad, Kosančićev venac, Kosancicev venac",50 m2,2.0,II/4
1.100 €,"Opština Stari grad, Centar, Simina",66 m2,2.0,IV/5
430 €,"Opština Rakovica, Vidikovac, Vidikovački venac",43 m2,2.0,IX/11
1.600 €,"Opština Voždovac, Lekino brdo, Tikveška",120 m2,4.0,I
700 €,"Opština Novi Beograd, Stari Merkator, Palmira Toljatija",50 m2,2.0,II/5
890 €,"Opština Stari grad, Dorćol, Cara Uroša",62 m2,3.0,IV/6
400 €,"Opština Palilula, Karaburma, Homoljska",50 m2,2.0,III/4
350 €,"Opština Voždovac, Lekino brdo, Todora Dukina 26",40 m2,2.0,PR/1
600 €,"Opština Zvezdara, Kluz, Bulevar kralja Aleksandra",43 m2,2.0,III/5
690 €,"Opština Stari grad, Dorćol, Cara Uroša",54 m2,3.0,I/7
1.300 €,"Opština Savski venac, Senjak, Puškinova",70 m2,2.0,I/3
400 €,"Opština Rakovica, Kanarevo brdo, Borska",55 m2,2.0,IX/12
350 €,"Opština Rakovica, Miljakovac, Dimitrija Koturovića",48 m2,2.0,III/4
270 €,"Opština Voždovac, Kumodraž, Brdska",50 m2,2.5,I/2
700 €,"Opština Voždovac, Dušanovac, Vidska",55 m2,1.5,I/5
650 €,"Opština Stari grad, Cara Dušana, Cara Dušana",44 m2,1.5,II/7
700 €,"Opština Stari grad, Dorćol, Žorža Klemansoa",52 m2,2.5,IV/6
550 €,"Opština Novi Beograd, Blok 45 (TC Enjub), Jurija Gagarina 175",66 m2,2.0,XIII/13
1.000 €,"Opština Novi Beograd, Blok 9a, Klare Cetkin",83 m2,3.0,XI/19
630 €,"Opština Voždovac, Lekino brdo, Strumička",51 m2,2.5,VPR/4
800 €,"Opština Vračar, Crveni krst, Đerdapska",47 m2,2.0,I/5
300 €,"Opština Rakovica, Resnik, Labinska",55 m2,2.0,N/A
1.400 €,"Opština Novi Beograd, Blok 65, Omladinskih brigada",86 m2,3.0,II/5
900 €,"Opština Vračar, Slavija, Makenzijeva",75 m2,3.0,II/5
430 €,"Opština Surčin, Ledine, Vojvođanska",64 m2,3.0,PR/2
