Price,Address,Squares,Rooms,Floor
1.500 €,"Opština Savski venac, Beograd na vodi, Bulevar Vudroa Vilsona",62 m2,2.0,V/21
600 €,"Opština Voždovac, Naselje Stepa Stepanović, Generala Štefanika",50 m2,1.5,II/6
N/A,N/A,N/A,N/A,N/A
790 €,"Opština Savski venac, Svetozara Markovića, Svetozara Markovića",50 m2,2.0,IV/6
450 €,"Opština Palilula, Karaburma, Jastrebačka",46 m2,2.0,II/2
500 €,"Opština Savski venac, Klinički centar, Dobropoljska",46 m2,2.0,I
900 €,"Opština Zvezdara, Cvetkova pijaca, Preševska",70 m2,3.0,I
1.250 €,"Opština Stari grad, Francuska",89 m2,3.0,II/5
450 €,"Opština Palilula, Višnjička Banja, Slanački put",60 m2,3.0,VPR/1
800 €,"Opština Palilula, Botanička bašta, Dalmatinska",77 m2,2.0,IV/7
1.200 €,"Opština Vračar, Krunski venac, Kneginje Zorke",95 m2,3.0,II
900 €,"Opština Vračar, Južni bulevar, Južni Bulevar",115 m2,4.0,V/7
400 €,"Opština Voždovac, Braće Jerković, Nade Naumovic 5",54 m2,2.0,I/4
650 €,"Opština Savski venac, Humska, Dobropoljska",60 m2,2.0,I/6
250 €,"Opština Palilula, Borča, 1. maja",25 m2,0.5,II/3
1.250 €,"Opština Savski venac, Dedinje, Alekse Bačvanskog",93 m2,5+,SUT/1
500 €,"Opština Čukarica, Banovo brdo, Petra Lekovića",54 m2,2.0,III
700 €,"Opština Vračar, Neimar, Internacionalnih brigada",47 m2,1.5,IV/6
1.400 €,"Opština Savski venac, Beograd na vodi, Luke Ćelovića Trebinjca",80 m2,2.0,VII/9
800 €,"Opština Zvezdara, Lion, Vranjska",47 m2,2.0,IV/5
2.400 €,"Opština Vračar, Hram svetog Save, Nebojšina",165 m2,3.0,V/5
400 €,"Opština Vračar, Crveni krst, ",49 m2,2.0,I/17
1.500 €,"Opština Savski venac, Beograd na vodi, ",94 m2,3.0,VIII/27
1.300 €,"Opština Savski venac, Beograd na vodi, ",81 m2,3.0,IX/13
400 €,"Opština Stari grad, Kalemegdan, ",21 m2,1.0,PR/4
450 €,"Opština Čukarica, Ada Ciganlija, ",56 m2,2.0,VI/6
400 €,"Opština Zvezdara, Bulevar kralja Aleksandra, Voje Veljkovića",40 m2,2.0,VPR
950 €,"Opština Stari grad, Dorćol, Strahinjića Bana",73 m2,3.0,III/5
2.200 €,"Opština Stari grad, Gundulićev venac, 11",101 m2,4.0,VI/7
2.000 €,"Opština Novi Beograd, Blok 65, Omladinskih brigada",93 m2,3.0,XV
1.350 €,"Opština Vračar, Neimar, Hadži Melentijeva",90 m2,3.0,III/5
800 €,"Opština Vračar, Bulevar kralja Aleksandra, Vojvode Bogdana",73 m2,3.0,VPR/4
400 €,"Opština Obrenovac, Obrenovac (mesto), Kralja Petra I",50 m2,2.0,II/5
450 €,"Opština Zemun, Altina, Dobanovački Put",47 m2,2.5,IV/5
350 €,"Opština Stari grad, Andrićev venac, Andrićev venac",12 m2,0.5,I/4
550 €,"Opština Zemun, Kej, Jovana Subotića",44 m2,2.0,II/3
500 €,"Opština Novi Beograd, Stari Merkator, Bulevar Mihajla Pupina 205",41 m2,1.0,V/17
1.150 €,"Opština Stari grad, Skupština, Majke Jevrosime",68 m2,3.0,IV/4
1.000 €,"Opština Savski venac, Beograd na vodi, Luke Celovica Trebinjca",58 m2,2.0,III/6
550 €,"Opština Novi Beograd, Blok 70a, Dr Agostina Neta",65 m2,2.0,VIII/8
900 €,"Opština Savski venac, Dedinje, kod Pinka",75 m2,3.0,III
1.800 €,"Opština Savski venac, Beograd na vodi, Hercegovačka",93 m2,3.0,VI
1.200 €,"Opština Novi Beograd, Blok 65, Bulevar heroja sa Košara",62 m2,3.0,I
950 €,"Opština Novi Beograd, Hotel Jugoslavija, Bulevar Nikole Tesle",60 m2,3.0,PR/5
800 €,"Opština Zemun, Zelena avenija, Tošin bunar",55 m2,2.5,I
1.000 €,"Opština Novi Beograd, Blok 65, Tadije Sondermajera",52 m2,2.0,VII/9
1.500 €,"Opština Savski venac, Beograd na vodi, Luke Ćelovića Trebinjca",77 m2,3.0,I/8
1.200 €,"Opština Savski venac, Beograd na vodi, Bulevar Vudroa Vilsona",55 m2,2.0,XXII/24
700 €,"Opština Novi Beograd, Blok 67a (A blok), Jurija Gagarina",39 m2,1.0,III/12
2.800 €,"Opština Novi Beograd, Blok 65, Tadije Sondermajera",160 m2,5.0,XXI/22
300 €,"Opština Vračar, Južni bulevar, Južni bulevar",22 m2,0.5,XI/13
500 €,"Opština Vračar, Kalenić pijaca, Baba Višnjina",44 m2,1.5,VPR
850 €,"Opština Vračar, Slavija, Svetozara Markovića",67 m2,2.5,I
1.100 €,"Opština Savski venac, Beograd na vodi, Luke Celovica Trebinjca",58 m2,2.0,IX/17
1.100 €,"Opština Savski venac, Beograd na vodi, Bulevar Vudroa Vilsona",56 m2,2.0,II/24
350 €,"Opština Vračar, Kalenić pijaca, Sumatovacka",26 m2,1.0,II/5
350 €,"Opština Čukarica, Čukarička padina, Radnicka",38 m2,1.0,III/7
800 €,"Opština Novi Beograd, Blok 65, Omladinskih Brigada",46 m2,2.0,V/6
400 €,"Opština Rakovica, Miljakovac, Čelebićka",75 m2,3.0,III/4
1.900 €,"Opština Savski venac, Beograd na vodi, Hercegovačka",90 m2,3.0,XV
3.000 €,"Opština Vračar, Čubura, Patrijarha Gavrila",240 m2,5.0,VI
850 €,"Opština Čukarica, Banovo brdo, Kraljice Katarine",110 m2,3.0,III
1.600 €,"Opština Savski venac, Beograd na vodi, Luke Ćelovića Trebinjca",75 m2,3.0,III
2.800 €,"Opština Savski venac, Kneza Miloša, Vojvode Milenka",100 m2,3.0,II
750 €,"Opština Novi Beograd, Blok 67a (A blok), Omladinskih brigada",42 m2,2.0,I/5
450 €,"Opština Savski venac, Humska, Kavadarska",29 m2,0.5,PR/2
1.200 €,"Opština Vračar, Južni bulevar, Braće Radovanović",68 m2,3.0,V/7
1.200 €,"Opština Zemun, Prvomajska, Železnička",126 m2,5+,II/2
400 €,"Opština Vračar, Bulevar kralja Aleksandra, Molerova",20 m2,1.0,VI/6
430 €,"Opština Vračar, Kalenić pijaca, Sinđelićeva",28 m2,0.5,VI/8
1.300 €,"Opština Voždovac, Lekino brdo, Kolašinska","74,30 m2",3.0,I/4
2.000 €,"Opština Savski venac, Beograd na vodi, BW Simfonija",86 m2,3.0,IX/16
2.650 €,"Opština Savski venac, Beograd na vodi, Nikolaja Kvarcova",140 m2,5+,VIII/8
1.100 €,"Opština Novi Beograd, Blok 67a (A blok), Uroša Martinovića",54 m2,2.0,I/7
2.200 €,"Opština Savski venac, Beograd na vodi, Hercegovačka",92 m2,3.0,VIII/20
1.000 €,"Opština Novi Beograd, Blok 65, Omladinskih brigada",62 m2,2.0,IV/7
700 €,"Opština Novi Beograd, Arena, Španskih boraca",67 m2,2.5,II/4
800 €,"Opština Savski venac, Beograd na vodi, Hercegovačka",29 m2,0.5,I/24
1.300 €,"Opština Savski venac, Beograd na vodi, Luke Ćelovića Trebinjca",54 m2,2.0,III/7
500 €,"Opština Voždovac, Centar, Save Maškovića",47 m2,2.0,II/7
380 €,"Opština Novi Beograd, Paviljoni, Generala Ždanova",23 m2,1.0,VI/6
550 €,"Opština Novi Beograd, Hotel Jugoslavija, Bulevar Nikole Tesle",36 m2,1.5,V/5
690 €,"Opština Stari grad, Skupština, Svetogorska",64 m2,2.0,III/6
600 €,"Opština Palilula, Karaburma, ",52 m2,2.5,II/5
420 €,"Opština Zemun, Pregrevica, Pregrevica",32 m2,1.0,PR
300 €,"Opština Zvezdara, Veliki Mokri Lug, Partizanska",54 m2,2.0,I/4
500 €,"Opština Rakovica, Skojevsko naselje, Luke Vojvodića",40 m2,2.0,VPR/3
800 €,"Opština Voždovac, Bulevar oslobođenja, Bulevar oslobođenja",76 m2,2.0,III/3
700 €,"Opština Vračar, Crveni krst, Branka Krsmanovića",60 m2,2.5,II/4
600 €,"Opština Zemun, Zemunske kapije, Šumadijska",52 m2,2.0,VPR
400 €,"Opština Grocka, Kaluđerica, Bulevar revolucije",40 m2,2.0,III/5
1.400 €,"Opština Savski venac, Beograd na vodi, Hercegovačka",56 m2,2.0,IX
1.590 €,"Opština Savski venac, Beograd na vodi, Luke Ćelovića Trebinjca",80 m2,3.0,PR/8
700 €,"Opština Novi Beograd, Blok 65, Omladinskih brigada",40 m2,1.0,III/7
850 €,"Opština Novi Beograd, Blok 65, Tadije Sondermajera",55 m2,2.0,II/9
700 €,"Opština Voždovac, Lekino brdo, Veselina Masleše",45 m2,2.0,III/4
350 €,"Opština Palilula, Krnjača, Sutjeska ulica 1.",50 m2,2.5,II/4
590 €,"Opština Vračar, Crveni krst, Vojvode Šupljikca",55 m2,2.0,VPR/3
380 €,"Opština Palilula, Karaburma, Marijane Gregoran",24 m2,1.0,PR/2
550 €,"Opština Savski venac, Humska, Ljutice Bogdana",62 m2,2.0,VI/12
370 €,"Opština Voždovac, Medaković 2, Radovana Simića Cige",35 m2,1.0,III/8
600 €,"Opština Zvezdara, Gradska bolnica, Velebitska",65 m2,2.5,II/3
430 €,"Opština Zvezdara, Đeram pijaca, Jedrenska",39 m2,1.0,III/5
990 €,"Opština Zemun, Gornji grad, Slavonska",78 m2,3.0,II/2
220 €,"Opština Zemun, Altina, Aleksandra Popovića",20 m2,0.5,II
1.100 €,"Opština Novi Beograd, YUBC, Bulevar Mihajla Pupina",90 m2,3.0,VI/6
600 €,"Opština Novi Beograd, Stari Merkator, Džona Kenedija",42 m2,2.0,II/6
530 €,"Opština Vračar, Čubura, Cerska",37 m2,1.5,I/4
500 €,"Opština Čukarica, Filmski grad, Arčibalda Rajsa",60 m2,2.5,I/4
650 €,"Opština Novi Beograd, Stari Merkator, Kursulina",40 m2,2.0,III/7
300 €,"Opština Vračar, Centar, Sime Igumanova",22 m2,1.0,XI/13
900 €,"Opština Vračar, Južni bulevar, Gavrila Principa",115 m2,4.0,V/7
800 €,"Opština Novi Beograd, Blok 65, Tosin Bunar",52 m2,2.0,III/6
650 €,"Opština Voždovac, Autokomanda, Vojvode Stepe",56 m2,2.0,II/4
799 €,"Opština Vračar, Crveni krst, Djerdapska",48 m2,2.0,I/5
1.070 €,"Opština Savski venac, Beograd na vodi, Luke Ćelovića Trebinjca",55 m2,2.0,I/23
1.500 €,"Opština Voždovac, Vojvode Stepe, ",83 m2,2.5,VII/12
2.500 €,"Opština Savski venac, Beograd na vodi, Nikolaja Kravcova",114 m2,3.0,VIII/9
400 €,"Opština Stari grad, Knez Mihailova, Rajićeva",24 m2,0.5,III/3
2.100 €,"Opština Savski venac, Beograd na vodi, Hercegovačka",86 m2,3.0,IX/16
450 €,"Opština Novi Beograd, Blok 70 (kineski tržni centar), Jurija Gagarina",56 m2,2.0,VIII/14
1.500 €,"Opština Savski venac, Beograd na vodi, Savska",86 m2,3.0,V/6
2.000 €,"Opština Savski venac, Beograd na vodi, Hercegovačka",115 m2,4.0,XXI
600 €,"Opština Voždovac, Lekino brdo, Miklošićeva",54 m2,2.5,PR
700 €,"Opština Savski venac, Dedinje, Josifa Marinkovića",58 m2,2.0,III/4
900 €,"Opština Zvezdara, Lion",80 m2,3.0,III/6
300 €,"Opština Palilula, Bogoslovija, Sloga",26 m2,1.0,II/4
1.700 €,"Opština Vračar, Gradić Pejton, Cara Nikolaja II",97 m2,3.0,N/A
1.800 €,"Opština Savski venac, Beograd na vodi",83 m2,3.0,V/8
800 €,"Opština Zvezdara, Lion",51 m2,2.0,VI/6
1.500 €,"Opština Savski venac, Resavska",95 m2,3.0,IV/5
650 €,"Opština Savski venac, Senjak, Vase Pelagica",45 m2,2.0,II/5
1.000 €,"Opština Voždovac, Lekino brdo, Todora Dukina",80 m2,3.0,VPR
300 €,"Opština Zemun, Bački Ilovik, Sremskih boraca",30 m2,0.5,III/3
400 €,"Opština Savski venac, Stadion Partizana, Oblakovska",43 m2,1.5,VPR/3
400 €,"Opština Zemun, Centar, Bežanijska",40 m2,1.0,I/2
1.300 €,"Opština Stari grad, Dorćol, Venizelosova",50 m2,2.0,V/6
1.100 €,"Opština Novi Beograd, Blok 67a (A blok), Jurija Gagarina",74 m2,3.0,V
850 €,"Opština Novi Beograd, Blok 67a (A blok), Jurija Gagarina",50 m2,2.0,VI
4.000 €,"Opština Vračar, Hram svetog Save, Nebojšina",240 m2,5.0,VI
350 €,"Opština Palilula, Bogoslovija, Čiče Romanijskog 9",40 m2,0.5,N/A
800 €,"Opština Voždovac, Činovnička kolonija",65 m2,2.0,III
500 €,"Opština Novi Beograd, Fontana, Pariske Komune",42 m2,2.0,PR/9
1.700 €,"Opština Savski venac, Beograd na vodi, Luke Ćelovića Trebinjca",89 m2,3.0,N/A
400 €,"Opština Novi Beograd, Blok 64, Gandijeva",40 m2,1.0,III/5
500 €,"Opština Novi Beograd, YUBC, Bulevar Mihajla Pupina",38 m2,1.0,IV/6
1.500 €,"Opština Vračar, Gospodara Vučića, Gospodara Vučića",90 m2,4.0,II/7
850 €,"Opština Novi Beograd, Blok 67a (A blok), Uroša Martinovića",56 m2,2.0,V
2.500 €,"Opština Savski venac, Dedinje",138 m2,4.0,N/A
1.600 €,"Opština Vračar, Crveni krst, ",90 m2,4.0,V
700 €,"Opština Novi Beograd, Blok 67 (Belvil), ",60 m2,2.0,VIII/12
600 €,"Opština Voždovac, Vitanovačka, Nestora Žučnog",49 m2,2.0,PR/4
1.600 €,"Opština Savski venac, Beograd na vodi, ","71,73 m2",3.0,III/14
450 €,"Opština Novi Beograd, Blok 21, Bulevar Mihajla Pupina",45 m2,2.0,II/8
999 €,"Opština Novi Beograd, Blok 64, Jurija Gagarina",90 m2,4.0,VI/7
500 €,"Opština Palilula, Višnjička Banja, Dragana Lukića",46 m2,2.0,PR/4
800 €,"Opština Zvezdara, Đeram pijaca, Marka Oreškovića",61 m2,2.5,III/6
1.300 €,"Opština Novi Beograd, Blok 65, Tadije Sondermajera Zeptera",70 m2,3.0,VIII/9
250 €,"Opština Grocka, Kaluđerica, Jovana Cvijića",30 m2,0.5,II/3
1.400 €,"Opština Savski venac, Beograd na vodi, Bulevar Vudroa Vilsona",80 m2,3.0,XI/15
1.550 €,"Opština Novi Beograd, Stari Merkator, Džona Kenedija",85 m2,2.0,IV/7
700 €,"Opština Novi Beograd, Ledine, Knjigovezačka 3",60 m2,2.5,VPR/4
1.650 €,"Opština Savski venac, Beograd na vodi, Hercegovačka",80 m2,3.0,N/A
899 €,"Opština Novi Beograd, Blok 67a (A blok), Uroša Martinovića",62 m2,2.0,IV/7
450 €,"Opština Zvezdara, Lion, Ravanicka",42 m2,1.5,II/3
500 €,"Opština Zvezdara, Denkova bašta, Mis Irbijeve",58 m2,2.0,III/5
1.200 €,"Opština Voždovac, Šumice, Djordja Kratovca",94 m2,4.0,III
790 €,"Opština Vračar, Crveni krst, Vidovdanska",47 m2,2.0,IV/6
1.500 €,"Opština Novi Beograd, Blok 67a (A blok)",80 m2,3.0,V
2.000 €,"Opština Savski venac, Dedinje",100 m2,4.0,I
1.200 €,"Opština Savski venac, Beograd na vodi, ",53 m2,2.0,IV/23
2.000 €,"Opština Savski venac, Senjak",130 m2,4.0,I
750 €,"Opština Vračar, Crveni krst",58 m2,2.0,I
700 €,"Opština Savski venac, Sarajevska",50 m2,2.0,II/5
650 €,"Opština Novi Beograd, Hotel Jugoslavija, Klare Cetkin",65 m2,3.0,I/4
900 €,"Opština Novi Beograd, Blok 70 (kineski tržni centar), Jurija Gagarina",100 m2,4.0,III/13
500 €,"Opština Voždovac, Autokomanda, Triše Kaclerovića",51 m2,2.0,III/4
1.200 €,"Opština Novi Beograd, Blok 67 (Belvil), Đorđa Stanojevića",80 m2,3.0,X/13
430 €,"Opština Vračar, Crveni krst, Vojislava Ilića",35 m2,1.5,VII/7
750 €,"Opština Savski venac, Dedinje, Sime Lozanića",61 m2,2.5,I
300 €,"Opština Zvezdara, Mirijevo, Jovanke Radaković",34 m2,1.5,PR/4
800 €,"Opština Novi Beograd, Bežanijska kosa 2, Nedeljka Gvozdenovica",90 m2,3.0,III/6
450 €,"Opština Čukarica, Žarkovo, Braće Škerović",70 m2,3.0,VPR/2
650 €,"Opština Zemun, Save Kovačevića, Bosanska",50 m2,1.5,I/1
200 €,"Opština Čukarica, Ostružnica, Buljubaše Ranka Uroševića",50 m2,3.0,I/3
1.100 €,"Opština Savski venac, Beograd na vodi, Hercegovačka",51 m2,2.0,IV
500 €,"Opština Palilula, Profesorska kolonija, Smederevska",57 m2,2.0,II/3
800 €,"Opština Savski venac, Beograd na vodi, Jurija Gagarina",56 m2,2.0,III/10
500 €,"Opština Stari grad, Bajlonijeva pijaca, Bulevar despota Stefana",39 m2,1.0,VI/9
900 €,"Opština Palilula, Bogoslovija, Dragoslava Srejovica",54 m2,1.5,N/A
1.200 €,"Opština Palilula, Profesorska kolonija, Ljubomira Stojanovića",111 m2,4.5,I/1
500 €,"Opština Zemun, Gornji grad, Novogradska",50 m2,2.0,III/5
450 €,"Opština Stari grad, Kalemegdan, Solunska",35 m2,1.0,III/8
650 €,"Opština Stari grad, Kopitareva gradina, Džordža Vašingtona",45 m2,2.0,VPR/5
680 €,"Opština Novi Beograd, Stari Merkator",59 m2,2.0,VII/11
1.100 €,"Opština Savski venac, Beograd na vodi",60 m2,2.0,I/8
500 €,"Opština Čukarica, Banovo brdo, Požeška",63 m2,2.5,III/5
500 €,"Opština Novi Beograd, Ledine, Isaka Singera",45 m2,1.5,I/5
190 €,"Opština Novi Beograd, Blok 63, Gandijeva",82 m2,3.0,I/10
600 €,"Opština Zemun, Dobanovačka, Dobanovačka",40 m2,2.0,III/3
1.500 €,"Opština Voždovac, Vojvode Stepe, Vojvode Stepe",83 m2,3.0,VII/12
290 €,"Opština Zemun, Gornji grad, Pregrevica",20 m2,1.0,I/2
400 €,"Opština Vračar, Bulevar kralja Aleksandra, Požarevačka",25 m2,0.5,V/7
400 €,"Opština Palilula, Rospi ćuprija, Slanački put",38 m2,2.0,I/4
350 €,"Opština Palilula, Karaburma, Velje Miljkovića",40 m2,2.0,I/4
280 €,"Opština Zvezdara, Gradska bolnica",38 m2,2.0,PR/2
250 €,"Opština Voždovac, Dušanovac, Kneza Bogosava",31 m2,1.0,VPR/2
350 €,"Opština Voždovac, Dušanovac, Kneza Bogosava",41 m2,2.0,I/2
700 €,"Opština Stari grad, Dorćol, Strahinjića Bana",55 m2,2.0,N/A
3.950 €,"Opština Savski venac, Beograd na vodi, Hercegovačka",110 m2,3.0,VIII/16
1.200 €,"Opština Novi Beograd, Blok 67 (Belvil), Bulevar Crvene Armije",80 m2,3.0,X/13
1.900 €,"Opština Novi Beograd, Blok 65, Omladinskih brigada",91 m2,3.0,XXI
750 €,"Opština Novi Beograd, YUBC, Bulevar Mihajla Pupina",65 m2,2.0,IV
2.400 €,"Opština Novi Beograd, Blok 65, Omladinskih brigada",93 m2,3.0,XV
1.600 €,"Opština Novi Beograd, Blok 67a (A blok), Jurija Gagarina",72 m2,3.0,VII/7
250 €,"Opština Novi Beograd, Stara Bežanija, Surčinska",40 m2,2.0,PR
1.300 €,"Opština Novi Beograd, Blok 67a (A blok), Jurija Gagarina",66 m2,3.0,VII/7
1.300 €,"Opština Savski venac, Beograd na vodi, Bulevar Vudroa Vilsona",78 m2,3.0,VIII/17
1.900 €,"Opština Savski venac, Kneza Miloša, Kneza Miloša",88 m2,3.0,VIII/24
700 €,"Opština Novi Beograd, Blok 63, Vojvođanska",52 m2,2.0,II
750 €,"Opština Čukarica, Banovo brdo, Majdanska Čukarica",75 m2,3.0,II/6
1.100 €,"Opština Novi Beograd, Blok 65, Tadije Sondermajera",56 m2,2.0,III
2.500 €,"Opština Savski venac, Beograd na vodi, Hercegovačka",119 m2,4.0,XI/24
1.600 €,"Opština Stari grad, Dorćol, Vojvode Dobrnjca",115 m2,3.0,I/3
700 €,"Opština Novi Beograd, Blok 30 (B92), Bulevar Mihajla Pupina",90 m2,3.0,VI/10
1.200 €,"Opština Savski venac, Beograd na vodi, Luke Ćelovića Trebinjca",56 m2,2.0,I/8
650 €,"Opština Palilula, Krnjača, Danka Popovića",75 m2,3.0,I/3
1.100 €,"Opština Stari grad, Centar, Jelene Ćetković",70 m2,3.0,II/5
1.300 €,"Opština Voždovac, Lekino brdo, Kruševačka",99 m2,3.0,IV/4
900 €,"Opština Voždovac, Lekino brdo, Rada Neimara",70 m2,3.0,VI/7
1.200 €,"Opština Stari grad, Kopitareva gradina",66 m2,3.0,II/5
1.500 €,"Opština Savski venac, Dedinje, Heroja Milana Tepića",104 m2,2.0,VPR/3
400 €,"Opština Vračar, Gradić Pejton, Vukice Mitrovic",26 m2,0.5,PSUT/2
300 €,"Opština Savski venac, Palata pravde, Dr Aleksandra Kostića",26 m2,0.5,III/6
750 €,"Opština Stari grad, Gundulićev venac, Vojvode Dobrnjca",60 m2,2.5,V/9
750 €,"Opština Palilula, Botanička bašta, Šajkaška",60 m2,2.5,V/9
500 €,"Opština Voždovac, Vojvode Stepe, Vitanovacka",55 m2,2.0,IV/12
1.400 €,"Opština Voždovac, Bulevar oslobođenja, Bulevar oslobođenja",140 m2,5.0,VPR/3
1.100 €,"Opština Savski venac, Centar, Vojvode Milenka",51 m2,2.0,V/8
550 €,"Opština Voždovac, Kumodraška, Nestora Žučnog",39 m2,1.0,VPR/4
500 €,"Opština Voždovac, Trošarina, Vojvode Stepe",27 m2,1.0,I/8
850 €,"Opština Vračar, Pravni fakultet, Prote Mateje",60 m2,2.5,I/1
950 €,"Opština Novi Beograd, Blok 24 (Super Vero), Bulevar Milutina Milankovića",84 m2,3.0,V
750 €,"Opština Voždovac, Vojvode Stepe, Kačerska",80 m2,3.0,N/A
800 €,"Opština Stari grad, Studentski trg, Gospodar Jevremova","52,50 m2",1.5,I/3
1.200 €,"Opština Stari grad, Dorćol, Visokog Stevana",60 m2,3.0,II/6
700 €,"Opština Zvezdara, Vukov Spomenik, Ćirila i Metodija",65 m2,3.0,III/6
990 €,"Opština Novi Beograd, Blok 65, Blok 65",54 m2,2.0,VII/9
900 €,"Opština Novi Beograd, Blok 65, Omladinskih brigada",62 m2,2.0,III/6
400 €,"Opština Novi Beograd, Fontana, Pariske komune",36 m2,1.5,I/8
600 €,"Opština Novi Beograd, Blok 67 (Belvil), Jurija Gagarina",31 m2,1.0,V/10
800 €,"Opština Stari grad, Skadarlija, Skadarska",70 m2,2.0,I/5
1.000 €,"Opština Savski venac, Beograd na vodi, Bulevar Vudroa Vilsona",55 m2,2.0,XXI/23
2.200 €,"Opština Savski venac, Beograd na vodi",89 m2,3.0,II/8
600 €,"Opština Novi Beograd, Blok 61, Jurija Gagarina",65 m2,3.0,I/9
250 €,"Opština Zvezdara, Mirijevo, Matice srpske",32 m2,1.0,IV/5
1.500 €,"Opština Novi Beograd, Blok 65, Bulevar heroja sa Košara",90 m2,4.0,II/11
700 €,"Opština Stari grad, Kosančićev venac",70 m2,3.0,PR/3
800 €,"Opština Voždovac, Lekino brdo, ",51 m2,2.0,II/4
750 €,"Opština Novi Beograd, Blok 21, Bulevar Zorana Djindjica 12",53 m2,2.0,I/11
600 €,"Opština Voždovac, Braće Jerković, Meštrovićeva",62 m2,2.5,IV/4
700 €,"Opština Palilula, Višnjička Banja, Slanački put","67,30 m2",2.5,II/6
2.100 €,"Opština Novi Beograd, Blok 65, Bulevar heroja sa Košara",105 m2,4.0,VI/9
600 €,"Opština Vračar, Centar, Tomaša Ježa",40 m2,1.5,II/4
300 €,"Opština Voždovac, Vitanovačka, Podravska",21 m2,1.5,PR/2
900 €,"Opština Zvezdara, Bulbulder, Živojina Žujovića",58 m2,2.5,II/4
850 €,"Opština Stari grad, Politika, Hilandarska",56 m2,2.0,III/5
650 €,"Opština Zvezdara, Kluz, Vojvode Blažete",82 m2,4.0,PR/6
999 €,"Opština Novi Beograd, Blok 64, Ulica Jurija Gagarina 26A",90 m2,4.0,VI/7
550 €,"Opština Zvezdara, Mirijevo, Dva bela goluba",47 m2,2.0,VPR/5
300 €,"Opština Novi Beograd, Bežanijska kosa 1, Vasilija Djurovica",60 m2,2.0,PSUT/1
499 €,"Opština Novi Beograd, Blok 9a, Bulevar Marsala Tolbuhina",46 m2,1.5,II/9
1.000 €,"Opština Vračar, Maksima Gorkog, Maksima Gorkog, Vracar",56 m2,2.0,V/6
350 €,"Opština Zvezdara, Mirijevo, 16. oktobra",45 m2,2.0,VIII/11
500 €,"Opština Vračar, Čubura, Cara Nikolaja II",45 m2,1.5,III/4
600 €,"Opština Voždovac, Naselje Stepa Stepanović, ","45,50 m2",2.0,I/7
600 €,"Opština Zvezdara, Mirijevo, Bulevar Kralja Aleksandra",50 m2,2.0,I/10
600 €,"Opština Zvezdara, Đeram pijaca, Đuke Dinić",45 m2,1.5,IV/6
400 €,"Opština Zvezdara, Medaković 3, Radoslava Bokšića",55 m2,1.5,VPR/4
300 €,"Opština Voždovac, Medaković 2, Ignjata Joba",28 m2,1.0,II/5
350 €,"Opština Zvezdara, Mirijevo, Kapetana Miloša Žunjića",35 m2,1.5,PR/5
550 €,"Opština Palilula, Višnjička Banja, Mirka Milojkovića",45 m2,2.0,III
470 €,"Opština Surčin, Surčin (mesto), Mome Kapora",54 m2,2.0,N/A
699 €,"Opština Stari grad, Gundulićev venac, Gundulićev venac",40 m2,2.0,II/4
550 €,"Opština Voždovac, Naselje Stepa Stepanović, 2. srpske armije",44 m2,2.0,VPR/6
350 €,"Opština Palilula, Kotež, Sutjeska ulica 7.",30 m2,0.5,II/5
1.700 €,"Opština Savski venac, Beograd na vodi, Bulevar Vudroa Vilsona",84 m2,3.0,VI
850 €,"Opština Zemun, Gornji grad, Zemunski stadion",65 m2,3.0,I/3
500 €,"Opština Novi Beograd, Blok 62, Jurija Gagarina",46 m2,1.5,IV/19
850 €,"Opština Novi Beograd, Blok 67a (A blok), Jurija Ggarina",51 m2,2.0,V/15
550 €,"Opština Zemun, Prvomajska, Đorđa Čutukovića",47 m2,2.0,II/2
550 €,"Opština Novi Beograd, Blok 30 (B92), Bulevar Mihajla Pupina",45 m2,1.5,V/16
450 €,"Opština Novi Beograd, Fontana, Bulevar Zorana Đinđića",35 m2,2.0,VI/8
790 €,"Opština Zemun, Retenzija, Radoja Dakića",48 m2,2.0,IV/6
550 €,"Opština Voždovac, Lekino brdo, Rade Končara",48 m2,2.0,I/4
550 €,"Opština Čukarica, Banovo brdo, Bogoljuba Čukića",47 m2,2.0,VPR/6
700 €,"Opština Voždovac, Vojvode Stepe, Vojvode Stepe",55 m2,2.0,I/6
1.200 €,"Opština Savski venac, Senjak, Sitnička",85 m2,3.0,I/2
850 €,"Opština Zvezdara, Konjarnik, Bojadžinska",93 m2,3.0,IV/4
700 €,"Opština Rakovica, Kanarevo brdo, Vukasovićeva",56 m2,3.0,VPR/3
200 €,"Opština Čukarica, Banovo brdo, Mira Popare",25 m2,0.5,PR
450 €,"Opština Stari grad, Francuska, Francuska",35 m2,0.5,III/6
1.200 €,"Opština Rakovica, Vidikovac, Kneza Višeslava",98 m2,4.0,III
750 €,"Opština Novi Beograd, Fontana, Otona Župančiča",58 m2,3.0,IX/9
250 €,"Opština Zemun, Zemun polje, Marka Milanovića",22 m2,1.0,VPR
550 €,"Opština Voždovac, Medaković padina, Nikole Altomanovića",47 m2,2.0,II/3
2.300 €,"Opština Vračar, Hram svetog Save, CUBURSKA",227 m2,5.0,IV/5
1.200 €,"Opština Savski venac, Kneza Miloša, Kneza Miloša",55 m2,2.0,I/6
1.000 €,"Opština Novi Beograd, Stari Merkator, Gramšijeva",90 m2,4.0,VPR/4
1.600 €,"Opština Zvezdara, Crveni krst, Branka Krsmanovića",95 m2,4.0,I/5
360 €,"Opština Zemun, Tošin bunar, Tošin bunar",36 m2,1.0,PR/3
600 €,"Opština Čukarica, Čukarička padina, Mladena Mitrića",49 m2,2.0,VII/7
2.500 €,"Opština Vračar, Hram svetog Save",203 m2,4.0,III/5
2.500 €,"Opština Vračar, Čubura, ",235 m2,5+,IV
800 €,"Opština Vračar, Crveni krst, ",70 m2,3.0,XIII/15
650 €,"Opština Vračar, Crveni krst, ",50 m2,2.0,III
650 €,"Opština Voždovac, Lekino brdo, ",55 m2,2.0,VPR/4
1.500 €,"Opština Vračar, Hram svetog Save, ",80 m2,2.5,II/5
550 €,"Opština Novi Beograd, Blok 67 (Belvil), Jurija Gagarina",45 m2,1.0,III/10
570 €,"Opština Stari grad, Skupština, Svetogorska",42 m2,1.0,V/5
350 €,"Opština Čukarica, Žarkovo, Zmajevačka",50 m2,2.5,N/A
900 €,"Opština Vračar, Crveni krst, Jadranska",43 m2,1.5,VI/8
500 €,"Opština Voždovac, Vojvode Stepe, Vojvode Stepe",50 m2,2.0,VI/6
900 €,"Opština Vračar, Južni bulevar, ",75 m2,3.0,III/5
400 €,"Opština Novi Beograd, Ledine, Inđijska",26 m2,1.0,II/2
700 €,"Opština Novi Beograd, Blok 45 (TC Enjub), Jurija Gagarina",65 m2,2.0,I/12
400 €,"Opština Zemun, Altina, Borhesova",50 m2,2.0,I/4
1.700 €,"Opština Savski venac, Beograd na vodi, Luke Celovica Trebinjca",78 m2,3.0,II/8
650 €,"Opština Stari grad, Studentski trg, Studentski trg",50 m2,2.0,VII/8
450 €,"Opština Zvezdara, Učiteljsko naselje, Mis Irbijeve",50 m2,2.0,I
700 €,"Opština Zvezdara, Vukov Spomenik, Kraljice Marije",80 m2,4.0,III/3
550 €,"Opština Zvezdara, Lion, Koste Abraševića",35 m2,1.5,III/4
800 €,"Opština Novi Beograd, Blok 45 (TC Enjub), Jurija Gagarina",70 m2,2.0,VI/9
1.600 €,"Opština Stari grad, Dorćol, Dubrovačka",77 m2,3.0,IV/6
1.700 €,"Opština Savski venac, Dedinje",136 m2,4.0,VPR/1
1.200 €,"Opština Palilula, Cvijićeva",70 m2,3.0,III/6
700 €,"Opština Zemun, Retenzija, Prve pruge",52 m2,2.0,III/4
600 €,"Opština Zemun, Save Kovačevića, Romanijska",48 m2,2.5,PR/3
850 €,"Opština Novi Beograd, Blok 67 (Belvil), Bulevar Crvene Armije",69 m2,2.0,XI/13
1.200 €,"Opština Savski venac, Senjak, Simićeva",100 m2,4.0,VPR/3
750 €,"Opština Vračar, Čubura, Šumatovačka",46 m2,2.0,VPR/3
320 €,"Opština Čukarica, Bele vode, Momcila cedica 44",43 m2,1.5,III/4
600 €,"Opština Novi Beograd, Blok 29, Bulevar Arsenija Carnojevica",46 m2,2.0,IV/6
2.000 €,"Opština Savski venac, Senjak, ",130 m2,3.0,I/3
300 €,"Opština Palilula, Borča, Ustavska 19",40 m2,2.0,VPR/2
300 €,"Opština Palilula, Borča, Kosovska 1",36 m2,1.5,III/3
