Price,Address,Squares,Rooms,Floor
450 €,"Opština Voždovac, Braće Jerković, Indire Gandi",49 m2,2.0,VII/7
600 €,"Opština Voždovac, Bioskop Voždovac, Vojvode Stepe",56 m2,2.0,V/6
450 €,"Opština Zemun, Altina, Ugrinovacki put 37. Deo",33 m2,1.0,III/5
600 €,"Opština Vračar, Južni bulevar, Oblakovska",50 m2,1.5,II/4
1.000 €,"Opština Vračar, Hram svetog Save, Skerlićeva",60 m2,3.0,I/5
600 €,"Opština Stari grad, Dorćol, Dobračina",33 m2,1.5,V/6
900 €,"Opština Stari grad, Kalemegdan, Rige od Fere",68 m2,3.0,II/5
2.300 €,"Opština Savski venac, Beograd na vodi",120 m2,3.0,X
450 €,"Opština Čukarica, Žarkovo, Mladenovačka",70 m2,3.0,IV
1.450 €,"Opština Vračar, Kalenić pijaca, Kičevska",101 m2,5+,IV/5
700 €,"Opština Zvezdara, Vukov Spomenik, Ruzveltova",46 m2,1.5,I/5
500 €,"Opština Zvezdara, Bulbulder, Đurićeva",32 m2,1.0,II/4
350 €,"Opština Zvezdara, Mirijevo, Matice Srpske",30 m2,1.5,PR/4
530 €,"Opština Voždovac, Autokomanda, Ranka Tajsića",41 m2,1.0,I/4
500 €,"Opština Zvezdara, Konjarnik, ",64 m2,2.5,IV/8
1.200 €,"Opština Novi Beograd, Tošin bunar, ","72,56 m2",3.0,III/8
1.300 €,"Opština Savski venac, Svetozara Markovića",75 m2,3.0,VI/7
800 €,"Opština Palilula, Palilulska pijaca, 27. marta",47 m2,2.0,I/8
650 €,"Opština Novi Beograd, Fontana, Studentska",42 m2,1.5,II/5
420 €,"Opština Vračar, Kalenić pijaca, Vojvode Šupljikca",22 m2,0.5,VPR/5
1.300 €,"Opština Zvezdara, Vukov Spomenik, Vojvode Bogdana",87 m2,3.0,III/7
900 €,"Opština Stari grad, Centar, Admirala Geprata",85 m2,3.0,I/5
350 €,"Opština Novi Beograd, Ledine, Dragutina Maslaća",50 m2,2.0,SUT/3
460 €,"Opština Vračar, Kalenić pijaca, Kursulina",35 m2,0.5,VPR/4
2.000 €,"Opština Savski venac, Beograd na vodi",94 m2,3.0,II
1.200 €,"Opština Vračar, Crveni krst, Vojvode Petka",95 m2,3.0,IV/6
300 €,"Opština Vračar, Kalenić pijaca, Golsvordijeva",22 m2,0.5,PR/6
350 €,"Opština Zvezdara, Mirijevo, Matice srpske",31 m2,1.5,VPR/3
650 €,"Opština Voždovac, Lekino brdo, Varvarinska",46 m2,2.5,II/4
350 €,"Opština Zvezdara, Bulevar kralja Aleksandra, Bulevar kralja Aleksandra 496",35 m2,1.0,V/5
450 €,"Opština Voždovac, Braće Jerković, Braće Jerković",61 m2,2.0,X/11
450 €,"Opština Vračar, Slavija, Svetozara Markovića",40 m2,1.5,PR/5
250 €,"Opština Palilula, Krnjača, Partizanski blok ulica 1.",25 m2,0.5,V/6
500 €,"Opština Surčin, Ledine, Bore Stankovića",81 m2,2.5,PR/2
450 €,"Opština Zemun, Meandri, Blagoja Jovovića",54 m2,1.5,VI/11
400 €,"Opština Rakovica, Labudovo brdo, Serdara Janka Vukotića",52 m2,3.0,IX/10
650 €,"Opština Novi Beograd, Blok 22, Bulevar Zorana Đinđića",50 m2,1.5,VI/6
600 €,"Opština Voždovac, Autokomanda, Vojvode Stepe",55 m2,2.0,V/7
500 €,"Opština Palilula, Botanička bašta, Bulevar Despota Stefana",35 m2,1.5,I/5
500 €,"Opština Voždovac, Bioskop Voždovac, Vitanovacka",47 m2,2.0,IV/5
2.200 €,"Opština Vračar, Crveni krst, Vilovskog",160 m2,5.0,III
400 €,"Opština Čukarica, Banovo brdo, Stevana Brakusa",40 m2,1.5,I/5
600 €,"Opština Stari grad, Zeleni venac, Kraljevića Marka",48 m2,2.0,III
450 €,"Opština Zvezdara, Zeleno brdo, Ruže Jovanović",65 m2,2.0,I/2
370 €,"Opština Zvezdara, Zvezdarska šuma",35 m2,1.0,PR/3
300 €,"Opština Savski venac, Sarajevska, Sarajevska",27 m2,0.5,IV/6
490 €,"Opština Vračar, Krunska, Krunska",36 m2,2.0,VI/6
2.000 €,"Opština Novi Beograd, Novi Merkator",105 m2,3.0,VII
470 €,"Opština Novi Beograd, Blok 4 (Politehnička akademija), ",35 m2,1.5,VI/8
900 €,"Opština Voždovac, Jove Ilića, ",55 m2,2.0,IV
800 €,"Opština Savski venac, Beograd na vodi, Kraljevića Marka",65 m2,3.0,IX
550 €,"Opština Novi Beograd, Blok 64, Gandijeva",50 m2,1.5,V/7
500 €,"Opština Voždovac, Lekino brdo, Strumička",73 m2,3.0,II/3
1.400 €,"Opština Stari grad, Centar, Džordža Vašingtona",130 m2,5+,VI/6
350 €,"Opština Čukarica, Julino brdo, Petra LUBARDE",35 m2,1.5,III/5
900 €,"Opština Vračar, Kalenić pijaca, Golsvordijeva",93 m2,3.0,I/5
550 €,"Opština Novi Beograd, Ledine, Rembrantova",67 m2,3.0,II/2
1.100 €,"Opština Stari grad, Dorćol, Kneginje Ljubice",71 m2,3.0,V/5
700 €,"Opština Voždovac, Lekino brdo, Todora Dukina",75 m2,3.0,I/4
900 €,"Opština Palilula, Višnjička Banja, Slanacki Put",110 m2,4.0,V/5
7.500 €,"Opština Savski venac, Dedinje, Raška",420 m2,5+,I/2
700 €,"Opština Stari grad, Zeleni venac, Brankova",32 m2,1.5,PR
800 €,"Opština Zvezdara, Lion, Ravanička",51 m2,2.0,VI/6
450 €,"Opština Voždovac, Banjica, Crnotravska",65 m2,2.0,I/24
1.550 €,"Opština Savski venac, Beograd na vodi",81 m2,3.0,XII
3.000 €,"Opština Savski venac, Beograd na vodi",113 m2,4.0,XVIII/23
600 €,"Opština Voždovac, Lekino brdo, Rade Končara",60 m2,2.0,PR/4
500 €,"Opština Voždovac, Banjica, Milorada Miškovića",41 m2,2.0,PR/4
700 €,"Opština Stari grad, Zeleni venac, Gavrila Principa",65 m2,3.0,I/3
450 €,"Opština Stari grad, Centar, Bulevar despota Stefana",44 m2,1.0,PR
1.000 €,"Opština Stari grad, Skupština",100 m2,4.0,V
300 €,"Opština Čukarica, Banovo brdo, Žarka Vukovića Pucara",23 m2,0.5,VPR/5
1.250 €,"Opština Savski venac, Dedinje, ",107 m2,4.0,I/3
450 €,"Opština Voždovac, Lekino brdo, Kolašinska",85 m2,3.0,IV/4
1.100 €,"Opština Savski venac, Beograd na vodi, BW Quartet 4",55 m2,2.0,III/8
400 €,"Opština Voždovac, Kumodraž, Bulevar Peka Dapčevića",47 m2,1.5,IV/4
370 €,"Opština Zemun, Autoput za Novi Sad, Timočka",55 m2,2.0,VPR/2
350 €,"Opština Zemun, Meandri, Zadrugarska",25 m2,1.0,PSUT/2
1.000 €,"Opština Zemun, Gornji grad, Slavonska",65 m2,1.5,II/3
700 €,"Opština Zemun, Gornji grad, Slavonska",35 m2,1.5,II/3
550 €,"Opština Zemun, Save Kovačevića, Dragana Rakića",53 m2,2.0,VPR/4
1.000 €,"Opština Zvezdara, Lion, Stanislava Sremčevića",100 m2,5+,III/4
900 €,"Opština Vračar, Centar, Gospodara Vučića",80 m2,3.0,I/5
400 €,"Opština Zvezdara, Mali Mokri Lug, Partizanska",45 m2,2.0,V/6
350 €,"Opština Zvezdara, Mali Mokri Lug, Partizanska",37 m2,2.0,VPR/4
350 €,"Opština Zvezdara, Mirijevo, Rudi Čajaveca",36 m2,1.5,SUT/4
350 €,"Opština Novi Beograd, Ledine, Kapetanovićeva",34 m2,2.0,I/3
200 €,"Opština Palilula, Kotež, Suvopoljska",25 m2,0.5,N/A
700 €,"Opština Palilula, Karaburma, Mirijevski Bulevar",55 m2,2.0,I/3
1.000 €,"Opština Stari grad, Centar, Majke Jevrosime",102 m2,4.0,IV/5
1.000 €,"Opština Voždovac, Naselje Stepa Stepanović, Timočke divizije",83 m2,3.0,IV/7
1.600 €,"Opština Vračar, Krunski venac, Smiljanićeva",92 m2,4.0,I/6
1.300 €,"Opština Novi Beograd, Blok 65, Bulevar heroja sa Košara",62 m2,2.0,I/9
400 €,"Opština Čukarica, Žarkovo, Ace Joksimovića",46 m2,2.0,VPR/4
850 €,"Opština Vračar, Hram svetog Save, Patrijarha Varnave",73 m2,3.5,II/4
800 €,"Opština Vračar, Centar, Kralja Milutina",68 m2,2.5,VII/10
1.200 €,"Opština Vračar, Crveni krst, Vidovdanska",97 m2,4.0,IV
1.000 €,"Opština Zemun, Kej, Stevana Markovića",57 m2,1.5,I
1.000 €,"Opština Stari grad, Dorćol",45 m2,1.5,V/7
330 €,"Opština Čukarica, Julino brdo, Porucnika Spasica i Masere",44 m2,1.5,VIII/10
2.500 €,"Opština Vračar, Kalenić pijaca, Patrijarha Varnave",203 m2,5.0,N/A
430 €,"Opština Voždovac, Saobraćajni fakultet, Kostolačka",40 m2,1.5,VPR/4
500 €,"Opština Voždovac, Banjica, Slobodana Jovića",43 m2,1.0,PR/2
600 €,"Opština Zemun, Gornji grad, Dobanovacka",40 m2,2.0,III/3
260 €,"Opština Rakovica, Kanarevo brdo, Reljkovićeva",23 m2,0.5,VPR/4
650 €,"Opština Voždovac, Bioskop Voždovac, Vojvode Stepe",56 m2,3.0,V/7
600 €,"Opština Novi Beograd, YUBC, Bulevar Mihajla Pupina",35 m2,1.5,III/6
350 €,"Opština Stari grad, Francuska, Pančevačka",24 m2,0.5,III/7
300 €,"Opština Palilula, Kotež, Obedska bara 8",31 m2,1.0,PR/2
600 €,"Opština Zemun, Altina, Ugrinovacki put 66d",80 m2,3.0,PR/1
250 €,"Opština Grocka, Kaluđerica, Sanska",37 m2,2.0,SUT/1
500 €,"Opština Vračar, Kalenić pijaca, Koče Kapetana",25 m2,0.5,VPR/6
250 €,"Opština Čukarica, Banovo brdo, Udbinska",20 m2,0.5,PR/5
700 €,"Opština Čukarica, Banovo brdo, Žarka Vukovića-Pucara",43 m2,2.0,II/3
400 €,"Opština Zvezdara, Cvetkova pijaca, Miodraga Petrovića Čkalje",33 m2,1.0,III/3
500 €,"Opština Voždovac, Šumice, Vladimira Tomanovića",51 m2,2.0,VPR/6
400 €,"Opština Zemun, Marija Bursać, Marija Bursać",65 m2,2.5,I/13
280 €,"Opština Palilula, Karaburma, Dr Ðordja Jovanovića 3,Beograd",44 m2,1.5,N/A
750 €,"Opština Stari grad, Skupština, Vlajkovićeva",50 m2,2.5,V/5
400 €,"Opština Voždovac, Kumodraška, Kumodraška",53 m2,2.0,N/A
400 €,"Opština Vračar, Krunska, Krunska",35 m2,1.0,VI/6
1.200 €,"Opština Novi Beograd, Arena, Bulevar Arsenija Čarnojevića",92 m2,3.0,VI
600 €,"Opština Novi Beograd, Blok 11",36 m2,1.5,I
2.000 €,"Opština Vračar, Cvetni trg, Kralja Milutina",120 m2,5+,VPR
1.000 €,"Opština Palilula, Višnjička Banja, Slobodana Jovanovića",80 m2,2.5,I/4
450 €,"Opština Rakovica, Vidikovac, Pilota Mihaila Petrovića br.17",63 m2,2.0,II/5
450 €,"Opština Zemun, Altina, Taška Načića",50 m2,2.0,IV/4
1.800 €,"Opština Novi Beograd, Blok 65",82 m2,3.0,XXI/24
250 €,"Opština Palilula, Kotež, Franca Kafke",30 m2,1.0,PR/1
1.600 €,"Opština Vračar, Crveni krst, Branka Krsmanovića",95 m2,4.0,I/5
400 €,"Opština Voždovac, Dušanovac, Vojvode Skopljanca",50 m2,2.0,I
500 €,"Opština Zvezdara, Vukov Spomenik, Zahumska",42 m2,1.5,PR/3
450 €,"Opština Palilula, Tašmajdan, Stanoja Glavaša",32 m2,1.0,V/8
1.000 €,"Opština Stari grad, Skadarlija, Venizelosova",47 m2,2.0,II/10
700 €,"Opština Palilula, Višnjička Banja, Stojana Stoleta Aranđelovića",80 m2,3.0,I/5
400 €,"Opština Zvezdara, Mirijevo, Dragoljuba Ristića",44 m2,2.0,VPR
500 €,"Opština Palilula, Centar, 27. marta",33 m2,1.0,II
650 €,"Opština Zvezdara, Konjarnik, Jovanke Bončić",98 m2,3.0,II/2
400 €,"Opština Voždovac, Vojvode Vlahovića, Milovana Vidakovića",43 m2,1.5,II/3
350 €,"Opština Grocka, Kaluđerica, Vojvode Stepe Stepanovića 1",40 m2,1.5,I/3
500 €,"Opština Zvezdara, Bulevar kralja Aleksandra, Bulevar kralja aleksandra 83",40 m2,1.0,PR/6
550 €,"Opština Zemun, Gornji grad, Krajiška",55 m2,2.5,I/2
500 €,"Opština Vračar, Južni bulevar, Juzni bulevar",33 m2,1.5,II/5
850 €,"Opština Voždovac, Vojvode Stepe, Vojvode Stepe",114 m2,4.0,XIV/23
550 €,"Opština Vračar, Južni bulevar, Južni Bulevar",45 m2,2.0,I/6
750 €,"Opština Čukarica, Bele vode, Bele vode",95 m2,3.0,II/2
700 €,"Opština Zemun, Gornji grad, Prvomajska",70 m2,3.0,IV
1.100 €,"Opština Savski venac, Dedinje, Bulevar kneza Aleksandra Karađorđevića",81 m2,3.0,III/5
600 €,"Opština Zemun, Save Kovačevića, Sava Burića",55 m2,2.0,III
700 €,"Opština Novi Beograd, Blok 67 (Belvil)",56 m2,2.0,IX/12
600 €,"Opština Vračar, Krunski venac, Smiljanićeva",54 m2,2.0,IV/5
1.000 €,"Opština Novi Beograd, Blok 64, Jurija Gagarina",90 m2,4.0,VI/7
900 €,"Opština Zemun, Gornji grad, Dobanovacka",50 m2,2.0,I/4
900 €,"Opština Voždovac, Trošarina, Pazinska",200 m2,4.0,IV/5
450 €,"Opština Savski venac, Beograd na vodi, Višegradska",33 m2,1.0,VI/6
1.390 €,"Opština Vračar, Hram svetog Save, Dubljanska",71 m2,3.0,III/4
1.750 €,"Opština Vračar, Hram svetog Save",122 m2,4.0,V
380 €,"Opština Zemun, Galenika, Momčila Radivojevića",52 m2,1.5,VPR/1
400 €,"Opština Voždovac, Autokomanda, Borisavljevićeva",35 m2,1.5,N/A
800 €,"Opština Zemun, Kalvarija, Vinarska",110 m2,3.0,I/2
800 €,"Opština Voždovac, Jajinci, Voje Radića",75 m2,3.0,III/3
400 €,"Opština Zemun, Kalvarija, Karla Soprona",44 m2,1.5,II/4
700 €,"Opština Stari grad, Gundulićev venac, Gundulićev venac",40 m2,2.0,II/4
600 €,"Opština Zvezdara, Vukov Spomenik, Vojvode Brane",45 m2,2.0,VPR/6
400 €,"Opština Zvezdara, Zeleno brdo, Budmanijeva",38 m2,2.0,II/2
1.150 €,"Opština Vračar, Hram svetog Save",82 m2,3.0,I
800 €,"Opština Vračar, Neimar, Južni bulevar",60 m2,2.5,III/6
800 €,"Opština Novi Beograd, Blok 65, Omladinskih brigada",46 m2,2.0,V/6
800 €,"Opština Stari grad, Dunavski kej, Dunavski kej",49 m2,2.0,V/7
1.100 €,"Opština Zvezdara, Lion, Bulevar kralja Aleksandra",85 m2,3.0,VI/8
600 €,"Opština Savski venac, Beograd na vodi, Savska",30 m2,1.0,I/5
300 €,"Opština Palilula, Cvijićeva, Cvijićeva",20 m2,1.0,V/5
1.200 €,"Opština Zemun, Zelena avenija, Petra Kočića",94 m2,3.0,VII/7
900 €,"Opština Zvezdara, Lion, Preševska",77 m2,3.0,V/7
3.000 €,"Opština Stari grad, Trg Republike, ",153 m2,5+,IV
200 €,"Opština Novi Beograd, Blok 18 (Staro sajmište), Slavka Šlandera",35 m2,2.0,N/A
550 €,"Opština Zvezdara, Severni bulevar, Zvezdarskih Jelki",31 m2,1.5,III/4
3.200 €,"Opština Stari grad, Politika, Makedonska",212 m2,5+,VI/8
2.600 €,"Opština Vračar, Bulevar kralja Aleksandra",94 m2,3.0,III
320 €,"Opština Čukarica, Banovo brdo, Blagoja Parovića",54 m2,2.0,I/2
1.200 €,"Opština Vračar, Bulevar kralja Aleksandra",54 m2,2.0,V
700 €,"Opština Voždovac, Lekino brdo, Dragačevska",96 m2,3.5,PR/3
1.000 €,"Opština Vračar, Južni bulevar, Maksima Gorkog",56 m2,2.0,V/6
800 €,"Opština Stari grad, Bajlonijeva pijaca, Đorđa Jovanovića",55 m2,2.0,III/7
2.200 €,"Opština Vračar, Hram svetog Save",138 m2,4.0,III
1.150 €,"Opština Novi Beograd, Blok 65, Tadije Sondermajera",56 m2,2.0,VIII/9
420 €,"Opština Zvezdara, Cvetkova pijaca, Dr Velizara Kosanovića",39 m2,2.0,VPR
900 €,"Opština Zvezdara, Mirijevo, Mihaila Bulgakova",150 m2,5+,PR
2.000 €,"Opština Vračar, Hram svetog Save, Stojana Protića",130 m2,5.0,N/A
700 €,"Opština Stari grad, Centar, Kraljice Natalije",60 m2,2.0,II/6
900 €,"Opština Savski venac, Dedinje, Bulevar kneza Aleksandra Karađorđevića",82 m2,3.0,III
500 €,"Opština Stari grad, Andrićev venac, Kralja Milana",34 m2,1.0,I/5
490 €,"Opština Zvezdara, Vukov Spomenik, Čelopečka",50 m2,2.0,III/5
780 €,"Opština Novi Beograd, Blok 21, Bulevar Zorana Đinđića",53 m2,2.5,V/11
270 €,"Opština Rakovica, Petlovo brdo, Petra Jovanovića",28 m2,1.0,II/5
550 €,"Opština Stari grad, Centar, Bulevar despota Stefana",36 m2,1.5,II
1.300 €,"Opština Stari grad, Trg Republike, Bulevar despota Stefana",93 m2,3.0,N/A
700 €,"Opština Voždovac, Dušanovac, Kruševačka",61 m2,3.0,I/3
1.800 €,"Opština Voždovac, Bulevar oslobođenja, Koste Jovanovića",223 m2,5.0,N/A
700 €,"Opština Zvezdara, Đeram pijaca, Preševska",78 m2,3.0,V
300 €,"Opština Zemun, Altina, Ugrinovački put 12. deo",50 m2,2.0,PR/1
450 €,"Opština Zemun, Prvomajska, Zadrugraska",52 m2,2.0,PSUT
300 €,"Opština Palilula, Karaburma, Roda",25 m2,0.5,VPR/3
1.600 €,"Opština Vračar, Hram svetog Save",85 m2,3.0,II
450 €,"Opština Savski venac, Ekonomski fakultet, Gavrila Principa",45 m2,1.5,I
400 €,"Opština Zvezdara, Medaković 3, Svetozara Radojčića",43 m2,2.0,III/3
4.300 €,"Opština Vračar, Hram svetog Save",226 m2,5.0,II/8
700 €,"Opština Voždovac, Lekino brdo, Vojvode Prijezde",50 m2,2.0,II/3
850 €,"Opština Zemun, Gornji grad, Dobanovačka",65 m2,3.0,I/3
550 €,"Opština Zvezdara, Bulbulder, Dimitrija Tucovića",35 m2,1.0,V/6
800 €,"Opština Stari grad, Gundulićev venac, Gundulićev Venac",37 m2,1.5,I/4
700 €,"Opština Voždovac, Vojvode Stepe, ",62 m2,3.0,V
2.500 €,"Opština Vračar, Hram svetog Save, Patrijarh Varnave",203 m2,5+,III/4
3.500 €,"Opština Vračar, Cvetni trg",237 m2,4.0,I
4.500 €,"Opština Savski venac, Dedinje",265 m2,4.0,I
450 €,"Opština Vračar, Crveni krst, ",35 m2,1.0,I/8
530 €,"Opština Palilula, Mašinski fakultet, Vladetina",40 m2,1.5,I/8
350 €,"Opština Voždovac, Lekino brdo, Veselina Masleše",30 m2,0.5,PR/5
600 €,"Opština Voždovac, FON - Bilećka, Konstantina Filozofa",56 m2,2.5,IV/4
650 €,"Opština Voždovac, Voždovačka crkva, Bose Milićević",50 m2,2.0,III/4
550 €,"Opština Voždovac, Gospodara Vučića, Veselina Masleše",42 m2,2.0,VPR/5
400 €,"Opština Palilula, Krnjača, Zrenjaninski put 45A",42 m2,2.0,I/5
450 €,"Opština Vračar, Južni bulevar, Kneginje Julije",30 m2,1.0,VPR/5
400 €,"Opština Zvezdara, Lipov lad",31 m2,1.5,I/10
1.350 €,"Opština Vračar, Kalenić pijaca, ",100 m2,4.0,IV/6
1.800 €,"Opština Čukarica, Banovo brdo, ",100 m2,4.0,VPR/2
400 €,"Opština Zemun, Donji grad, Cara Dušana",63 m2,2.0,II/3
500 €,"Opština Čukarica, Žarkovo",30 m2,1.0,VPR/5
800 €,"Opština Vračar, Centar, Krunska",35 m2,1.0,VI/6
800 €,"Opština Stari grad, Terazije, Kralja Milana",41 m2,1.5,III/6
1.300 €,"Opština Voždovac, Lekino brdo, Kolasinska","74,30 m2",3.0,I/4
500 €,"Opština Vračar, Bulevar kralja Aleksandra",43 m2,2.0,V/5
350 €,"Opština Čukarica, Čukarička padina, Lazarevački drum",48 m2,1.0,PR/4
650 €,"Opština Voždovac, Jove Ilića, Jove Ilića",65 m2,3.0,VI/6
550 €,"Opština Zvezdara, Gradska bolnica",51 m2,2.0,II/4
1.500 €,"Opština Stari grad, Skupština, Stevana Sremca",74 m2,3.0,VI/6
600 €,"Opština Novi Beograd, Ledine, Danila Bate Stojkovića",48 m2,1.5,I/4
500 €,"Opština Savski venac, Balkanska",48 m2,2.0,I/3
1.500 €,"Opština Savski venac, Beograđanka, Svetozara Markovića",78 m2,2.5,I/6
800 €,"Opština Savski venac, Karađorđeva",60 m2,2.0,II/8
350 €,"Opština Zvezdara, Mali Mokri Lug, Prijepoljska",65 m2,3.0,PR
700 €,"Opština Čukarica, Cerak, Kosmajska",74 m2,2.0,I/3
700 €,"Opština Novi Beograd, Hotel Jugoslavija, Prve pruge",52 m2,2.0,III/4
2.650 €,"Opština Savski venac, Beograd na vodi",140 m2,5.0,VIII
650 €,"Opština Stari grad, Centar",50 m2,2.0,VPR/3
500 €,"Opština Zvezdara, Slavujev venac, Milana Vukosa",52 m2,2.0,VPR
1.000 €,"Opština Zvezdara, Cvetkova pijaca, Vojvode Dovezenskog",104 m2,4.0,II/2
350 €,"Opština Palilula, Višnjička Banja, FOTINE PEJOVIĆ 14",75 m2,3.0,PR/3
600 €,"Opština Voždovac, Medaković 3",78 m2,3.0,III
690 €,"Opština Voždovac, Lekino brdo, ",47 m2,2.0,VPR/4
400 €,"Opština Palilula, Višnjička Banja, Sestara Bukumirović",65 m2,2.0,I/2
550 €,"Opština Čukarica, Julino brdo, ",55 m2,2.5,III/6
500 €,"Opština Voždovac, Dušanovac, Admirala Vukovića",46 m2,1.5,II/2
400 €,"Opština Palilula, Tašmajdan, Đušina",36 m2,1.5,SUT/4
300 €,"Opština Zvezdara, Kluz, Franje Kluza",38 m2,1.5,I/1
450 €,"Opština Voždovac, Vojvode Vlahovića, ",44 m2,2.5,I/3
1.500 €,"Opština Stari grad, Centar, Strahinjića Bana",100 m2,3.0,VPR/2
2.300 €,"Opština Stari grad, K-District, Bulevar vojvode Bojovića",122 m2,4.0,IV/8
750 €,"Opština Novi Beograd, Fontana, Otona Zupancica",58 m2,3.0,IX/9
600 €,"Opština Novi Beograd, Opština, Omladinskih Brigada",42 m2,2.0,VI/11
850 €,"Opština Novi Beograd, Fontana, Narodnih heroja",27 m2,3.0,XXX/30
850 €,"Opština Palilula, Tašmajdan, Majora Ilica",45 m2,2.0,I/7
800 €,"Opština Savski venac, Beograd na vodi, Hercegovacka",35 m2,1.0,XII/17
1.000 €,"Opština Novi Beograd, Bežanijska kosa 1, Partizanske avijacije",95 m2,4.0,V/6
1.000 €,"Opština Zvezdara, Lion, Gusinjska",118 m2,3.0,VII/8
500 €,"Opština Zvezdara, Zeleno brdo, Vladimira Gortana",32 m2,1.0,III/5
500 €,"Opština Novi Beograd, Hotel Jugoslavija, Gramšijeva",81 m2,2.0,N/A
600 €,"Opština Čukarica, Banovo brdo",60 m2,2.0,I/2
300 €,"Opština Novi Beograd, Ledine, Dravska",32 m2,1.5,PR
400 €,"Opština Zemun, Altina, Moroslava Antića",100 m2,2.5,II/2
500 €,"Opština Novi Beograd, Blok 72, MIleve Marić Anštajn",34 m2,1.5,I/6
350 €,"Opština Čukarica, Čukarička padina, Obalskih radnika",46 m2,1.5,II/5
200 €,"Opština Palilula, Karaburma, Srneticka",20 m2,0.5,III/5
400 €,"Opština Voždovac, Vojvode Vlahovića, Irske desete divizije",33 m2,1.5,I/3
900 €,"Opština Vračar, Kalenić pijaca, Cara Nikolaja II",90 m2,3.0,VPR/4
300 €,"Opština Rakovica, Miljakovac, Stanka Paunovića Veljka",36 m2,1.5,V/5
540 €,"Opština Voždovac, Vojvode Stepe, Vojvode Stepe",61 m2,2.0,II/5
450 €,"Opština Voždovac, Braće Jerković, Dragice Končar",55 m2,3.0,VPR/6
500 €,"Opština Zemun, Galenika, Dunavskih virova",50 m2,1.5,VI/7
500 €,"Opština Čukarica, Čukarička padina",51 m2,2.0,VPR/4
700 €,"Opština Vračar, Kalenić pijaca",70 m2,2.0,V
700 €,"Opština Savski venac, Dedinje, Joce Jovanovića",56 m2,2.0,II/2
300 €,"Opština Zvezdara, Mirijevo, Teodora Mirijevskog",38 m2,1.5,PR/3
770 €,"Opština Stari grad, Dorćol, Cara Dušana",52 m2,2.0,XI/13
300 €,"Opština Čukarica, Žarkovo, Spasenovićeva",34 m2,1.0,IV/4
1.000 €,"Opština Vračar, Kalenić pijaca, Hadži Ruvimova",107 m2,4.0,VI/7
500 €,"Opština Palilula, Botanička bašta, Poenkareova",23 m2,0.5,IV/6
500 €,"Opština Zvezdara, Lion, Miloša Zečevića",50 m2,2.0,II/3
250 €,"Opština Palilula, Borča, Vojvođanska",35 m2,1.0,PR/2
700 €,"Opština Vračar, Južni bulevar, Južni bulevar",35 m2,1.0,VI/7
1.800 €,"Opština Vračar, Kalenić pijaca, Baba Višnjina",106 m2,4.0,I
1.150 €,"Opština Vračar, Pravni fakultet, Resavska",88 m2,3.5,III/5
550 €,"Opština Voždovac, Vojvode Stepe, Bose Milićević",50 m2,2.0,N/A
750 €,"Opština Zvezdara, Vukov Spomenik, Dimitrija Tucovića",43 m2,1.5,III/7
600 €,"Opština Vračar, Kalenić pijaca, Kneginje Zorke",35 m2,1.0,V/6
400 €,"Opština Stari grad, Bajlonijeva pijaca, Džordža Vašingtona",28 m2,1.0,I/5
900 €,"Opština Vračar, Gospodara Vučića, Gosp vucica 3",80 m2,2.5,I/4
650 €,"Opština Palilula, Botanička bašta, Sajkasja 29",50 m2,1.5,IX/11
800 €,"Opština Vračar, Južni bulevar, Šumatovačka",46 m2,1.5,VPR/5
350 €,"Opština Zemun, Galenika, Dunavskih virova",40 m2,1.5,I/2
600 €,"Opština Novi Beograd, Blok 58, Jurija Gagarina",31 m2,1.0,V/10
550 €,"Opština Vračar, Južni bulevar, Gospodara Vučića",49 m2,2.0,I
800 €,"Opština Zvezdara, Đeram pijaca, Đevđelijska",52 m2,1.0,PR/5
800 €,"Opština Savski venac, Mostarska petlja, Kneza Miloša",60 m2,2.0,I/4
800 €,"Opština Novi Beograd, Blok 70 (kineski tržni centar), Jurija Gagarina",64 m2,2.5,IX/15
1.800 €,"Opština Palilula, Palilulska pijaca, Ilije Garašanina",100 m2,3.0,VI/6
650 €,"Opština Stari grad, Centar, Hilandarska",65 m2,2.5,VPR/1
300 €,"Opština Zvezdara, Kluz, Vitezova Karađorđeve zvezde",34 m2,1.5,II/3
500 €,"Opština Stari grad, Dorćol, Solunska",46 m2,2.0,I/4
500 €,"Opština Voždovac, FON - Bilećka, Niksicka 6",64 m2,2.0,II/4
350 €,"Opština Zvezdara, Bulevar kralja Aleksandra, Steve Vargaša",35 m2,2.0,VPR
400 €,"Opština Vračar, Bulevar kralja Aleksandra, Daničareva",40 m2,2.0,I
500 €,"Opština Vračar, Slavija, Bulevar oslobođenja",30 m2,0.5,II/2
500 €,"Opština Vračar, Krunska, Krunska",66 m2,2.0,VPR
450 €,"Opština Novi Beograd, Ledine, Vojvođanska",45 m2,2.0,I/4
450 €,"Opština Stari grad, Kalemegdan, Rige od Fere",30 m2,1.5,III
800 €,"Opština Savski venac, Beograd na vodi, Koče Popovića",47 m2,2.5,III/4
500 €,"Opština Savski venac, Centar, Karađorđeva",30 m2,1.5,I/6
700 €,"Opština Savski venac, Beograd na vodi, Koče Popovića",42 m2,2.0,IV/4
2.500 €,"Opština Vračar, Hram svetog Save, Šumatovačka",127 m2,4.0,V/5
750 €,"Opština Voždovac, Medaković 3, 28. juna",70 m2,3.0,II/2
1.000 €,"Opština Stari grad, Studentski trg, Studentski trg",50 m2,2.0,I/9
850 €,"Opština Zvezdara, Zeleno brdo, Dušana Radovića",63 m2,3.0,VPR/2
700 €,"Opština Zvezdara, Lion, ",40 m2,2.0,VPR/3
650 €,"Opština Savski venac, Stadion Partizana, Humska",34 m2,1.5,PR/4
650 €,"Opština Novi Beograd, Novi Merkator, Omladinskih brigada",61 m2,2.5,VPR/4
500 €,"Opština Vračar, Južni bulevar, Južni bulevar",56 m2,2.0,VII/7
2.200 €,"Opština Novi Beograd, Blok 65, Omladinskih brigada",108 m2,4.0,IX/30
400 €,"Opština Savski venac, Humska, Sitnička",22 m2,0.5,PR/1
650 €,"Opština Stari grad, Terazije, Kralja Milana Stari Grad",35 m2,1.5,I/8
700 €,"Opština Novi Beograd, Blok 29, Bulevar Arsenija Čarnojevića",65 m2,3.0,N/A
350 €,"Opština Zemun, Altina, Predraga Lakovića",55 m2,2.0,I/2
750 €,"Opština Stari grad, Gundulićev venac, Budimska",42 m2,2.0,V/5
1.600 €,"Opština Vračar, Bulevar kralja Aleksandra, Bulevar kralja Aleksandra",125 m2,4.0,III/5
430 €,"Opština Zemun, Centar, Filipa Višnjića",36 m2,1.0,III/4
1.700 €,"Opština Vračar, Krunski venac, Smiljanićeva",92 m2,4.0,I/6
1.200 €,"Opština Stari grad, Kalemegdan, ",68 m2,3.0,VI/7
500 €,"Opština Voždovac, Lekino brdo, Braće Kovač",30 m2,2.0,I/1
500 €,"Opština Voždovac, Braće Jerković, Nade Naumović",45 m2,1.5,II/4
1.300 €,"Opština Stari grad, Obilićev venac, Obilićev Venac",85 m2,4.0,II/6
600 €,"Opština Palilula, Krnjača, Igora Vasiljeva",105 m2,4.0,VPR/2
570 €,"Opština Voždovac, Vojvode Stepe, Nikšićka",52 m2,2.0,III/3
250 €,"Opština Grocka, Kaluđerica",50 m2,2.0,VPR/1
500 €,"Opština Vračar, Južni bulevar, Juzni Bulevar",36 m2,1.0,VI/7
1.200 €,"Opština Novi Beograd, Hotel Hyatt, ",92 m2,2.0,VII/8
1.000 €,"Opština Savski venac, Dedinje, Koste Racina",75 m2,3.0,III/3
1.000 €,"Opština Vračar, Hram svetog Save, ",60 m2,3.0,I
1.200 €,"Opština Novi Beograd, Blok 29, Bulevar Arsenija Čarnojevića",93 m2,3.0,VI
1.950 €,"Opština Savski venac, Beograd na vodi, ",99 m2,3.0,I
400 €,"Opština Voždovac, Lekino brdo, Murska",30 m2,1.0,VPR
390 €,"Opština Zemun, Altina, Božidarčeva",55 m2,2.0,I/1
450 €,"Opština Novi Beograd, Fontana, Pariske komune",57 m2,2.0,III/8
750 €,"Opština Voždovac, Saobraćajni fakultet, Otokara Keršovanija",70 m2,2.0,PR/1
650 €,"Opština Zvezdara, Bulevar kralja Aleksandra, Milana Rakića",71 m2,3.0,II/5
1.500 €,"Opština Novi Beograd, Blok 64, Omladinskih brigada",60 m2,2.0,XXI
600 €,"Opština Stari grad, Centar, Vojvode Dobrnjca",44 m2,2.0,IV/4
350 €,"Opština Palilula, Karaburma, Karpatska",30 m2,1.5,I/1
