Price,Address,Squares,Rooms,Floor
950 €,"Opština Vračar, Gradić Pejton, Vojvode Dragomira",90 m2,3.0,VI/7
2.200 €,"Opština Vračar, SC Vračar, Loznička",132 m2,4.0,V/6
250 €,"Opština Čukarica, Sremčica, Beogradska",23 m2,1.0,PR
450 €,"Opština Zemun, Prvomajska, Mića Radakovića",50 m2,2.0,VI/8
650 €,"Opština Voždovac, Naselje Stepa Stepanović, Generala Stefanika",45 m2,2.0,IV/5
900 €,"Opština Savski venac, Senjak, Bulevar Vojvode Misica",75 m2,3.0,VPR/6
850 €,"Opština Palilula, Višnjička Banja, Mirka Milojkovica",70 m2,3.0,VPR/5
700 €,"Opština Voždovac, Centar, Strazilovska",53 m2,2.0,IV/5
500 €,"Opština Zemun, Karađorđev trg, 22. oktobra",32 m2,1.0,VPR/4
1.550 €,"Opština Savski venac, Beograd na vodi, Luke Ćelovića Trebinjca",58 m2,2.0,I/8
550 €,"Opština Voždovac, Lekino brdo, Varvarinska",43 m2,2.0,III/4
800 €,"Opština Vračar, Hram svetog Save, Hadži Melentijeva",70 m2,3.0,III/4
400 €,"Opština Vračar, Kalenić pijaca",35 m2,1.5,PR
3.500 €,"Opština Savski venac, Senjak, Milovana Glišića",174 m2,4.0,I/3
450 €,"Opština Vračar, Crveni krst, Metohijska",34 m2,1.5,II/6
300 €,"Opština Rakovica, Miljakovac, Pećka",35 m2,1.5,PR/4
4.300 €,"Opština Savski venac, Beograd na vodi, Bulevar Vudroa Vilsona",215 m2,5+,IX
600 €,"Opština Novi Beograd, Opština, Omladinskih brigada",42 m2,2.0,VI/11
1.500 €,"Opština Savski venac, Dedinje, Vladimira Gaćinovića",95 m2,3.0,VPR/1
700 €,"Opština Novi Beograd, Blok 21, Bulevar Zorana Đinđića",53 m2,2.0,N/A
2.000 €,"Opština Savski venac, Beograd na vodi, BW Eterna",94 m2,3.0,II/8
700 €,"Opština Vračar, Čubura, Maksima Gorkog",46 m2,1.5,II/6
650 €,"Opština Palilula, Tašmajdan, 27. marta",34 m2,1.5,II/7
500 €,"Opština Voždovac, Vojvode Vlahovića, Braće Jerković",59 m2,2.0,VIII/10
1.000 €,"Opština Stari grad, Kosančićev venac, Dobrice Ćosića",52 m2,2.5,VPR/2
300 €,"Opština Palilula, Borča, Popovačka",49 m2,1.5,II/4
300 €,"Opština Rakovica, Petlovo brdo, Nićifora Ninkovića",38 m2,1.0,PR/1
1.000 €,"Opština Savski venac, Dedinje, Stjepana Filipovića",59 m2,3.0,X/15
630 €,"Opština Voždovac, Kumodraž, Vojvode Vlahovića",66 m2,3.0,IV/4
750 €,"Opština Zemun, Zemunske kapije, Šumadijska",42 m2,2.0,III/6
550 €,"Opština Zemun, Gornji grad, Sarajevska",40 m2,2.0,II/3
580 €,"Opština Novi Beograd, Blok 67 (Belvil), Jurija Gagarina",31 m2,1.0,IV/9
470 €,"Opština Voždovac, Saobraćajni fakultet, Vojvode Stepe",35 m2,1.0,VI
250 €,"Opština Voždovac, Lekino brdo, Varvarinska",28 m2,1.5,PR/1
200 €,"Opština Palilula, Borča, Popova bara nova 405.",35 m2,1.0,PR/1
1.500 €,"Opština Stari grad, Skupština, Palmotićeva",204 m2,5+,VI/7
400 €,"Opština Zemun, Kej, Karamatina 35",34 m2,1.0,PR/1
1.200 €,"Opština Voždovac, Lekino brdo, ",55 m2,3.0,III/4
4.500 €,"Opština Savski venac, Beograd na vodi, Bulevar Vudroa Vilsona",225 m2,5+,IX
350 €,"Opština Voždovac, Braće Jerković, Vojvode Vlahovića",33 m2,1.0,PR/4
550 €,"Opština Stari grad, Gundulićev venac, Dobračina",24 m2,1.5,I/4
550 €,"Opština Stari grad, Trg Republike, Vase Čarapića",25 m2,1.0,I/5
600 €,"Opština Zvezdara, Zeleno brdo, Ivana Gradnika",66 m2,3.0,I/1
500 €,"Opština Voždovac, Saobraćajni fakultet, Vojvode Stepe",30 m2,1.0,VIII/12
500 €,"Opština Voždovac, Centar, Bulevar oslobođenja",41 m2,2.5,VII/8
900 €,"Opština Voždovac, Naselje Stepa Stepanović, 2. srpske armije",65 m2,3.0,I/6
1.600 €,"Opština Savski venac, Beograd na vodi, Nikolaja Kravcova",78 m2,3.0,II/9
500 €,"Opština Voždovac, Darvinova pošta, Kumodraška",59 m2,2.5,I/3
1.300 €,"Opština Stari grad, Skupština",100 m2,3.0,II/3
1.100 €,"Opština Novi Beograd, Blok 23, Bulevar Milutina Milankovića",75 m2,3.0,I/21
450 €,"Opština Vračar, Kalenić pijaca, ",39 m2,1.5,I/3
750 €,"Opština Voždovac, Bulevar oslobođenja",50 m2,2.0,VII/9
800 €,"Opština Savski venac, Brankova, ",62 m2,3.0,II
550 €,"Opština Stari grad, Obilićev venac, ",35 m2,1.0,III/6
700 €,"Opština Vračar, Crveni krst, ",50 m2,1.5,N/A
1.500 €,"Opština Vračar, Hram svetog Save",80 m2,3.0,I/3
400 €,"Opština Zvezdara, Konjarnik, Milića Rakića",40 m2,1.5,XI/11
1.400 €,"Opština Savski venac, Beograd na vodi, Nikolaja Kravcova",77 m2,3.0,II/9
350 €,"Opština Stari grad, Dorćol, Tadeuša Košćuška",40 m2,1.0,PR/5
1.250 €,"Opština Vračar, Centar, Bulevar Kralja Aleksandra",58 m2,2.0,II/5
400 €,"Opština Zvezdara, Konjarnik, Ustanicka 244",52 m2,2.0,I/6
1.200 €,"Opština Vračar, Južni bulevar, Braće Radovanović 19",70 m2,3.0,V/7
450 €,"Opština Zemun, Retenzija, Prve Pruge",30 m2,1.0,V/8
1.000 €,"Opština Zemun, Kej, Stevana Markovica",57 m2,2.0,I/2
900 €,"Opština Stari grad, Dorćol, Visokog Stevana",72 m2,3.0,III/7
500 €,"Opština Voždovac, Naselje Stepa Stepanović, Milica Marinovica",65 m2,3.0,I/4
2.000 €,"Opština Savski venac, Beograd na vodi, Bulevar Vudroa Vilsona",90 m2,3.0,XVI/23
650 €,"Opština Novi Beograd, Blok 4 (Politehnička akademija), ",42 m2,1.5,II/5
650 €,"Opština Vračar, Južni bulevar, Mlade Bosne",73 m2,3.0,I/3
900 €,"Opština Stari grad, Knez Mihailova, Cara Uroša",51 m2,2.0,VI/8
600 €,"Opština Zvezdara, Crveni krst, Vojislava Ilića",60 m2,3.0,II/4
480 €,"Opština Zvezdara, Medaković 3, Svetozara Radojcica",46 m2,2.5,I/4
400 €,"Opština Rakovica, Kanarevo brdo, Vukasovićeva",56 m2,2.0,II/5
350 €,"Opština Novi Beograd, Blok 34 (Carina - Studentski grad), ",30 m2,1.0,I/4
350 €,"Opština Voždovac, Medaković 2, ",33 m2,1.0,XI/13
600 €,"Opština Zemun, Gornji grad",60 m2,2.5,PR/4
450 €,"Opština Palilula, Karaburma, Marijane Gregoran",40 m2,1.0,IV/7
850 €,"Opština Stari grad, Dorćol, ",40 m2,2.0,IV
380 €,"Opština Zvezdara, Cvetkova pijaca, Tihomira Višnjevca",34 m2,1.5,VPR/3
750 €,"Opština Zemun, Centar, Danila Medakovića",52 m2,2.0,I/2
1.200 €,"Opština Stari grad, Gundulićev venac, Venizelosova",71 m2,3.0,II/7
800 €,"Opština Novi Beograd, Blok 67 (Belvil), Bulevar Crvene Armije",68 m2,2.0,XII
600 €,"Opština Palilula, Mašinski fakultet, Ivankovačka",50 m2,2.0,II
900 €,"Opština Novi Beograd, Blok 45 (TC Enjub), Jurija Gagarina",54 m2,2.0,II/10
600 €,"Opština Grocka, Kaluđerica, Kralja Petra I",220 m2,3.0,I
1.000 €,"Opština Čukarica, Banovo brdo, Olivere Marković",86 m2,4.0,I/2
320 €,"Opština Rakovica, Miljakovac, Dimitrija Koturovića",22 m2,0.5,VPR/3
450 €,"Opština Palilula, Višnjička Banja, Mirka Milojkovića",45 m2,2.0,I/5
350 €,"Opština Zemun, Donji grad, Petra Kočića",40 m2,1.5,PR
450 €,"Opština Voždovac, Kumodraž",83 m2,4.0,I/1
850 €,"Opština Voždovac, Bulevar oslobođenja, Bulevar oslobođenja",90 m2,3.0,II/4
400 €,"Opština Voždovac, Medaković padina",55 m2,2.5,II
600 €,"Opština Voždovac, Braće Jerković, Vojvode Vlahovica",55 m2,2.0,III/3
400 €,"Opština Vračar, SC Vračar, Vojvode Šupljikca",20 m2,0.5,I/6
550 €,"Opština Zemun, Prvomajska, Ostoje Živkovića",52 m2,3.0,I/3
1.500 €,"Opština Stari grad, Dorćol, Gospodar Jevremova",107 m2,4.0,II/7
750 €,"Opština Vračar, Kalenić pijaca, Koče Kapetana",58 m2,3.0,I/3
650 €,"Opština Vračar, Čubura, Svetolika Rankovića",43 m2,1.5,VPR/4
550 €,"Opština Voždovac, FON - Bilećka, Vojvode Stepe",44 m2,1.5,IV/10
450 €,"Opština Novi Beograd, Ledine, Jorgandžijska",78 m2,2.5,N/A
500 €,"Opština Novi Beograd, Paviljoni, ",31 m2,1.5,I
200 €,"Opština Zvezdara, Lion, Preševska",32 m2,2.0,VPR/1
550 €,"Opština Zvezdara, Vukov Spomenik",54 m2,2.0,PR/3
300 €,"Opština Rakovica, Vidikovački venac, Vidikovački venac",55 m2,2.0,VIII/13
300 €,"Opština Palilula, Kotež, Jovana Isailovića",56 m2,1.5,II/3
200 €,"Opština Palilula, Borča, 1. maja",30 m2,1.0,PR
400 €,"Opština Novi Beograd, Hotel Jugoslavija, Prve Pruge",30 m2,1.0,V/8
400 €,"Opština Zemun, Retenzija, Prve Pruge",30 m2,1.0,V/8
850 €,"Opština Rakovica, Miljakovac, Miljakovačke livade",110 m2,4.0,VPR/2
1.300 €,"Opština Vračar, Slavija, Svetozara Markovića",75 m2,2.5,V/7
550 €,"Opština Čukarica, Čukarička padina, Mladena Mitrića 2",33 m2,0.5,VPR/7
450 €,"Opština Voždovac, Vojvode Stepe, Ljuba Vučkovića",50 m2,1.5,I/6
2.500 €,"Opština Savski venac, Senjak",118 m2,3.0,I/4
350 €,"Opština Čukarica, Rupčine, Mitrofana Hilandarca",86 m2,3.0,II/2
900 €,"Opština Savski venac, Dedinje",70 m2,2.0,I/4
300 €,"Opština Rakovica, Vidikovačka padina, Mome Stanojlovića",31 m2,1.5,III/4
600 €,"Opština Voždovac, Banjica, Radomira Markovića","59,56 m2",3.0,I/4
600 €,"Opština Čukarica, Cerak, Breza",75 m2,3.0,V/10
550 €,"Opština Stari grad, Dorćol, Tadeuša Košćuška",34 m2,1.0,VII/11
380 €,"Opština Zemun, Galenika, Petra Jovovića",36 m2,2.0,VPR/2
350 €,"Opština Voždovac, Medaković 2, Radovana Sića Cige",40 m2,2.0,VIII/12
1.000 €,"Opština Novi Beograd, Hotel Jugoslavija, Gramšijeva",92 m2,3.0,VPR/5
520 €,"Opština Novi Beograd, Blok 22, Bulevar Arsenija Čarnojevića",30 m2,1.0,I/6
450 €,"Opština Rakovica, Miljakovac, Borska",40 m2,1.5,III/5
690 €,"Opština Zvezdara, Kluz, Budmanijeva",60 m2,3.0,VPR/4
600 €,"Opština Vračar, Čubura, Svetozara Gligorića",34 m2,1.0,I/3
500 €,"Opština Savski venac, Centar, Sarajevska",45 m2,1.5,PR/1
300 €,"Opština Grocka, Vinča, Smederevski put",58 m2,2.5,PR/1
800 €,"Opština Voždovac, Lekino brdo, Braće Kovač",65 m2,3.0,II/4
1.000 €,"Opština Stari grad, Dorćol, Gospodar Jevremova",42 m2,1.5,V
550 €,"Opština Zvezdara, Dimitrija Tucovića, Dimitrija Tucovića",62 m2,2.5,V/7
450 €,"Opština Zvezdara, Dimitrija Tucovića, Dimitrija Tucovića",30 m2,1.0,I/7
450 €,"Opština Voždovac, Autokomanda, Ustanička",30 m2,0.5,I/4
1.100 €,"Opština Novi Beograd, Arena, Bulevar Arsenija Čarnojevića",91 m2,3.0,III/6
320 €,"Opština Palilula, Borča, Elemirska",35 m2,1.5,I/1
220 €,"Opština Palilula, Borča, Elemirska",25 m2,0.5,PR/1
550 €,"Opština Voždovac, Konjarnik, Vladimira Tomanovića",71 m2,2.0,I/6
1.300 €,"Opština Stari grad, Topličin venac, Topličin Venac",115 m2,3.0,I/5
300 €,"Opština Grocka, Kaluđerica, Milana Rakića",70 m2,0.5,PR
500 €,"Opština Zvezdara, Medaković 3, Braće Srnić",40 m2,1.5,I/6
310 €,"Opština Zvezdara, Bulevar kralja Aleksandra, ",30 m2,0.5,II/7
650 €,"Opština Novi Beograd, Blok 72, Mileve Marić Ajnštajn",34 m2,1.5,V/7
1.000 €,"Opština Vračar, Kalenić pijaca, Mutapova",76 m2,3.0,II/6
600 €,"Opština Novi Beograd, Blok 22, Antifasisticke borbe",68 m2,2.0,II/6
400 €,"Opština Zvezdara, Đeram pijaca, Bulevar kralja Aleksandra",23 m2,1.5,III/3
350 €,"Opština Zvezdara, Mirijevo, Zorana Radmilovića",42 m2,1.5,V/6
600 €,"Opština Zvezdara, Lion, Silvija Kranjčevića",64 m2,3.0,I/3
2.200 €,"Opština Stari grad, Dorćol, Dobračina",81 m2,3.0,II/5
450 €,"Opština Vračar, Centar, Požarevačka",31 m2,1.0,I/3
700 €,"Opština Novi Beograd, Opština, Bulevar Mihajla Pupina",48 m2,2.0,I/14
400 €,"Opština Zvezdara, Cvetanova ćuprija, Mihajla Kostića Pljake",47 m2,2.5,III/4
450 €,"Opština Voždovac, Banjica, Milorada Miškovića",35 m2,1.5,II/4
590 €,"Opština Zvezdara, Dimitrija Tucovića, Dimitrija Tucovića",32 m2,0.5,IV/6
1.000 €,"Opština Zvezdara, Severni bulevar, Ledinačka",50 m2,1.5,II/4
450 €,"Opština Novi Beograd, Blok 63, Gandijeva",59 m2,2.0,IX/9
1.800 €,"Opština Savski venac, Zeleni venac, Lomina",126 m2,4.5,I/6
2.500 €,"Opština Stari grad, Dorćol",96 m2,2.0,II
400 €,"Opština Zvezdara, Zeleno brdo, Lošinjska",32 m2,1.5,I/3
500 €,"Opština Zvezdara, Mirijevo, Davorina Jenka",65 m2,3.0,III/4
350 €,"Opština Voždovac, Braće Jerković, Jovana Bijelića",40 m2,1.0,PR/4
550 €,"Opština Voždovac, Vojvode Stepe, Voždove kapije",30 m2,0.5,VI/12
450 €,"Opština Palilula, Karaburma, Aleksandra Fleminga",27 m2,0.5,II/6
1.200 €,"Opština Vračar, Neimar, Braničevska",80 m2,3.0,III/4
700 €,"Opština Vračar, Kalenić pijaca, Mileševska",55 m2,2.0,V/6
750 €,"Opština Vračar, Kalenić pijaca, Golsvordijeva",94 m2,4.0,V/6
400 €,"Opština Palilula, Botanička bašta, Bulevar despota Stefana",45 m2,1.5,VII/7
2.000 €,"Opština Voždovac, Trošarina, Beranska",184 m2,4.0,N/A
1.300 €,"Opština Savski venac, Senjak",110 m2,3.0,PR
500 €,"Opština Voždovac, Banjica, Radomira Markovića","43,77 m2",2.0,III/4
270 €,"Opština Zvezdara, Mirijevo, ",30 m2,1.0,PR/4
2.200 €,"Opština Vračar, Čubura, Cara Nikolaja II",104 m2,3.0,III
600 €,"Opština Vračar, Centar, Svetozara Markovića",52 m2,2.0,I/4
400 €,"Opština Palilula, Karaburma, ",40 m2,1.0,III
450 €,"Opština Palilula, Karaburma, Dragoslava Srejovića",65 m2,3.0,I/3
750 €,"Opština Vračar, Hram svetog Save, Nebojšina",65 m2,3.0,III/5
1.900 €,"Opština Savski venac, Dedinje, Slavka Ćuruvije",148 m2,3.0,VPR/1
900 €,"Opština Voždovac, Braće Jerković, Sime Matavulja",118 m2,4.0,II/2
2.300 €,"Opština Vračar, Centar, Resavska",104 m2,2.0,I/6
700 €,"Opština Čukarica, Banovo brdo, Kraljice Katarine",60 m2,3.0,II/3
600 €,"Opština Vračar, Svetozara Markovića, Svetozara Markovica",52 m2,2.0,PR/4
450 €,"Opština Vračar, Južni bulevar, Južni bulevar",48 m2,2.0,N/A
400 €,"Opština Zvezdara, Kluz, Murmanska",45 m2,2.0,I/4
450 €,"Opština Voždovac, Braće Jerković, Sime Matavulja",48 m2,2.0,I/2
650 €,"Opština Savski venac, Dedinje, Bulevar kneza Aleksandra Karađorđevića",45 m2,2.0,II
800 €,"Opština Stari grad, Trg Republike",50 m2,2.0,II/5
1.200 €,"Opština Savski venac, Klinički centar, Miloša Pocerca",89 m2,5+,V/5
750 €,"Opština Novi Beograd, Bežanijska kosa 2, Marka Čelebonovića",61 m2,2.0,VI/6
250 €,"Opština Vračar, Crveni krst, Cerska",25 m2,1.0,PR/1
600 €,"Opština Vračar, Hram svetog Save, Nebojšina",70 m2,2.0,III/6
500 €,"Opština Voždovac, Braće Jerković, Braće Jerković",61 m2,2.5,VPR/4
2.000 €,"Opština Zvezdara, Vukov Spomenik, Zahumska",130 m2,5+,II/4
1.000 €,"Opština Voždovac, Vojvode Stepe, Nestora Žučnog",79 m2,3.0,VPR/4
450 €,"Opština Rakovica, Stari Košutnjak, Trstenjakova",41 m2,2.5,I/3
350 €,"Opština Voždovac, Braće Jerković, Petra Dobrovica 12/2",45 m2,1.5,PR
800 €,"Opština Savski venac, Dedinje, Diane Budisavljević",70 m2,2.0,II
1.100 €,"Opština Savski venac, Dedinje, Neznanog junaka",62 m2,2.0,N/A
700 €,"Opština Vračar, Južni bulevar, Cerska",46 m2,1.5,III
2.000 €,"Opština Vračar, Slavija, Svetozara Markovića",185 m2,4.5,III/7
850 €,"Opština Savski venac, Beograđanka, Kraljice Natalije",80 m2,2.0,IV/12
400 €,"Opština Čukarica, Banovo brdo, Trebevićka",39 m2,2.0,IV/4
300 €,"Opština Čukarica, Žarkovo, Dimitrija Avramovića",25 m2,1.0,II/5
4.500 €,"Opština Savski venac, Senjak, Milovana Glišića",156 m2,4.0,PR
500 €,"Opština Novi Beograd, Blok 5, Bulevar maršala Tolbuhina",70 m2,3.0,II
420 €,"Opština Palilula, Palilulska pijaca, Stanoja Glavaša",45 m2,1.0,VI/7
350 €,"Opština Zvezdara, Lipov lad, Svetomira Nikolajevića",33 m2,1.5,PSUT/4
700 €,"Opština Savski venac, Beograd na vodi, Belgrade Waterfront-BW Aria",37 m2,1.0,I/19
550 €,"Opština Zvezdara, Mirijevo, Matice Srpske",60 m2,2.0,III/10
800 €,"Opština Palilula, Hala Pionir, Dragoslava Srejovića",49 m2,2.0,III/10
1.700 €,"Opština Savski venac, Beograđanka, Svetozara Markovića",133 m2,2.0,VII/7
400 €,"Opština Palilula, Centar, Sime Šolaje",38 m2,1.0,IV/4
1.500 €,"Opština Čukarica, Banovo brdo, Kneza Višeslava",115 m2,4.0,I/3
3.000 €,"Opština Vračar, Hram svetog Save, Braničevska",130 m2,4.5,V
800 €,"Opština Savski venac, Sarajevska, ",83 m2,3.0,VI/6
380 €,"Opština Zemun, Ugrinovačka, Ugrinovačka",40 m2,1.0,PR/2
350 €,"Opština Novi Beograd, Blok 70 (kineski tržni centar), Jurija Gagarina",45 m2,1.5,VPR/14
900 €,"Opština Stari grad, Knez Mihailova, Krlja Ptra",49 m2,2.0,PR/6
650 €,"Opština Zvezdara, Gradska bolnica, Dimitrija Tucovića",67 m2,3.0,V/7
1.100 €,"Opština Stari grad, Kalemegdan, Žorža Klemansoa",80 m2,2.0,IV/6
600 €,"Opština Novi Beograd, Fontana, Studentska",45 m2,2.0,II/4
400 €,"Opština Zemun, Save Kovačevića, Sava Burića",45 m2,1.5,III/11
650 €,"Opština Čukarica, Banovo brdo, Nedeljka Čabrinovića",50 m2,2.0,VPR/6
300 €,"Opština Novi Beograd, Stara Bežanija, Vojvođanska",40 m2,1.0,PR/1
700 €,"Opština Vračar, Bulevar kralja Aleksandra, ",35 m2,1.0,V/6
5.900 €,"Opština Stari grad, Obilićev venac, ",294 m2,5+,II
2.200 €,"Opština Savski venac, Beograd na vodi, ",90 m2,3.0,V/17
1.100 €,"Opština Voždovac, Vojvode Stepe, Kumodraska",120 m2,4.0,II/3
1.500 €,"Opština Novi Beograd, Stari Merkator, Džona Kenedija",82 m2,3.0,VI/9
1.600 €,"Opština Savski venac, Beograd na vodi, Luke Celovica Trebinjca",77 m2,3.0,V/7
650 €,"Opština Voždovac, Lekino brdo, Petrovaradinska",40 m2,2.0,I/5
850 €,"Opština Voždovac, FON - Bilećka, Mosorska",68 m2,3.0,II/3
1.250 €,"Opština Stari grad, Dorćol, Bulevar vojvode Bojovića",57 m2,2.0,I/6
500 €,"Opština Zvezdara, Mirijevo, Jovanke Radaković",39 m2,1.5,IV/4
1.800 €,"Opština Novi Beograd, Blok 9a, ",126 m2,4.0,I
3.000 €,"Opština Savski venac, Beograd na vodi, Luke Ćelovića Trebinjca 50",111 m2,4.0,V/16
220 €,"Opština Palilula, Ćalije, Radmile Savićević",20 m2,0.5,N/A
700 €,"Opština Voždovac, FON - Bilećka, Pukovnika Pejovića",55 m2,2.0,III/4
550 €,"Opština Zvezdara, Denkova bašta",44 m2,1.5,IV/5
750 €,"Opština Stari grad, Cara Dušana, Cara Dušana",54 m2,2.0,XI/13
350 €,"Opština Zvezdara, Mirijevo",56 m2,2.0,I
290 €,"Opština Grocka, Kaluđerica",26 m2,0.5,II/3
800 €,"Opština Vračar, Čubura, Sazonova",46 m2,1.5,VPR/5
350 €,"Opština Čukarica, Julino brdo, Poručnika Spasića i Mašere",42 m2,1.0,N/A
350 €,"Opština Zvezdara, Mirijevo, Klanička stara",38 m2,1.5,I/5
350 €,"Opština Palilula, Višnjička Banja, Draginje Adamović",56 m2,2.0,I/3
350 €,"Opština Palilula, Karaburma, Patrisa Lumumbe",35 m2,2.0,PSUT
650 €,"Opština Voždovac, Šumice, Ljermontova",74 m2,3.0,XII/18
200 €,"Opština Palilula, Kotež, Slavka Kolara",25 m2,0.5,I/1
800 €,"Opština Stari grad, Dorćol, Pančićeva",52 m2,2.0,VII/8
600 €,"Opština Palilula, Botanička bašta, 27. marta",30 m2,1.0,IV/5
450 €,"Opština Rakovica, Miljakovac, Stevana Opačića",60 m2,2.0,IV/6
450 €,"Opština Voždovac, Banjica, Radomira Markovića","38,50 m2",2.0,IV/4
400 €,"Opština Voždovac, Banjica, Radomira Markovića","33,43 m2",1.0,III/4
550 €,"Opština Novi Beograd, Blok 30 (B92), Bulevar Zorana Đinđića",42 m2,2.0,I/10
500 €,"Opština Novi Beograd, Stari Merkator, Dzona Kenedija",45 m2,2.0,VIII/9
1.200 €,"Opština Vračar, Centar",106 m2,4.0,I/4
900 €,"Opština Savski venac, Beograd na vodi, Luke Ćelovića Trebinjca",59 m2,2.0,II
450 €,"Opština Novi Beograd, Blok 64, Nehruova",40 m2,1.0,VI
600 €,"Opština Novi Beograd, Blok 72, Mileve Maric Ajnstajn",43 m2,2.0,I/7
500 €,"Opština Čukarica, Banovo brdo, Kneza Višeslava",65 m2,3.0,I/5
700 €,"Opština Zemun, Donji grad, Magistratski Trg",36 m2,2.0,IV/4
700 €,"Opština Novi Beograd, Stari Merkator, Dzona Kenedija",45 m2,2.0,IV/6
650 €,"Opština Novi Beograd, Blok 44 (TC Piramida), Nehruova",51 m2,2.0,IV/6
1.200 €,"Opština Novi Beograd, Blok 38, Bulevar Arsenija Carnojevica",72 m2,3.0,VII/8
850 €,"Opština Savski venac, Beograd na vodi, ",36 m2,0.5,I
750 €,"Opština Voždovac, Autokomanda, Tabanovačka",83 m2,3.0,II/2
600 €,"Opština Voždovac, Trošarina, Beranska",46 m2,1.5,II/8
900 €,"Opština Stari grad, Cara Dušana, Skender Begova",60 m2,2.0,II/5
1.200 €,"Opština Rakovica, Stari Košutnjak, Milana Blagojevića Španca",87 m2,4.0,II/2
250 €,"Opština Zvezdara, Gradska bolnica, Novice Cerovića",35 m2,1.5,PR/2
1.750 €,"Opština Novi Beograd, Blok 22, Bulevar Arsenija Čarnojevića",174 m2,5+,VI/6
400 €,"Opština Vračar, Hram svetog Save, Patrijarha Varnave",25 m2,1.0,IV/4
700 €,"Opština Palilula, Hadžipopovac, Primorska",40 m2,2.0,II/2
320 €,"Opština Zvezdara, Mirijevo, ",30 m2,0.5,VPR/4
300 €,"Opština Voždovac, Braće Jerković, ",31 m2,1.0,VPR/4
800 €,"Opština Savski venac, Beograđanka, ",95 m2,3.5,I/4
750 €,"Opština Palilula, Hadžipopovac, ",68 m2,2.5,PR/1
770 €,"Opština Palilula, Tašmajdan, ",70 m2,3.0,III/12
750 €,"Opština Zvezdara, Lion, ",69 m2,3.0,V/7
1.600 €,"Opština Novi Beograd, Blok 63, Jurija Gagarina",70 m2,3.0,VII/7
850 €,"Opština Palilula, Tašmajdan, Karnegijeva",60 m2,2.0,PR/17
400 €,"Opština Zvezdara, Mirijevo, Vladislava Bajčevića",57 m2,2.0,VI/8
750 €,"Opština Voždovac, Dušanovac, Vojvode Djurovica",45 m2,2.0,II/4
550 €,"Opština Vračar, Čubura, Svetolika Rankovića",43 m2,1.5,VPR/4
600 €,"Opština Vračar, Crveni krst, Vojvode Šupljikca",35 m2,1.0,IV/6
700 €,"Opština Stari grad, Centar, Dositejeva",32 m2,1.5,IV/6
450 €,"Opština Novi Beograd, Blok 45 (TC Enjub), Jurija Gagarina",60 m2,2.0,XV/15
400 €,"Opština Zvezdara, Denkova bašta, Vojvode Dovezenskog",43 m2,1.5,SUT/2
280 €,"Opština Čukarica, Julino brdo, Siniše Stankovića",30 m2,0.5,II/3
500 €,"Opština Voždovac, Trošarina, Pazinska",37 m2,1.5,II/5
1.500 €,"Opština Novi Beograd, Blok 9a, Džona Kenedija",80 m2,3.0,I
500 €,"Opština Zvezdara, Učiteljsko naselje, Mis Irbijeva",50 m2,3.0,I/1
850 €,"Opština Voždovac, Jove Ilića",74 m2,3.0,IV
460 €,"Opština Palilula, Višnjička Banja, Slobodana Jovanovića",50 m2,2.0,IV/4
600 €,"Opština Vračar, Cvetni trg, Njegoševa",29 m2,1.0,I/5
420 €,"Opština Voždovac, Braće Jerković, Indire Gandi",42 m2,1.0,VI/6
500 €,"Opština Vračar, Slavija, Beogradska",36 m2,1.5,VI/6
400 €,"Opština Voždovac, Medaković 1, ",35 m2,2.0,I/2
450 €,"Opština Čukarica, Žarkovo, Kopaonička",55 m2,2.0,II/2
750 €,"Opština Vračar, Hram svetog Save, Patrijarha Varnave",52 m2,2.0,VPR/5
400 €,"Opština Vračar, Hram svetog Save, Brane Crnčevića",29 m2,0.5,VII/7
700 €,"Opština Zvezdara, Vukov Spomenik, Jovana Ćirilova",48 m2,2.0,II/6
800 €,"Opština Stari grad, 25. maj, Tadeuša Košćuška",82 m2,3.0,V/6
430 €,"Opština Čukarica, Čukarička padina, ",41 m2,1.0,III/6
500 €,"Opština Vračar, Čubura, Šumatovačka",28 m2,0.5,I/6
700 €,"Opština Stari grad, Skadarlija, Strahinjića Bana",50 m2,2.0,VPR/8
700 €,"Opština Vračar, Čubura, Sokolska",53 m2,2.0,II/5
1.000 €,"Opština Palilula, Višnjica, Lepe Stamenković",130 m2,3.0,I/2
600 €,"Opština Voždovac, Trošarina, Save Maškovića",48 m2,1.5,VI/8
550 €,"Opština Voždovac, Banjica, Crnotravska",80 m2,3.0,X/22
450 €,"Opština Novi Beograd, Paviljoni, ",35 m2,1.0,I/4
900 €,"Opština Stari grad, 25. maj, Visokog Stevana",72 m2,3.0,III/7
900 €,"Opština Voždovac, Autokomanda, Admirala Vukovića",100 m2,2.0,N/A
1.000 €,"Opština Stari grad, Obilićev venac, Maršala Birjuzova",72 m2,2.0,IV
240 €,"Opština Palilula, Krnjača, Grge Andrijanovića ulica 5.",30 m2,0.5,VPR/3
1.500 €,"Opština Vračar, Čubura, Sokolska",130 m2,4.0,III/3
800 €,"Opština Vračar, Hram svetog Save, Kneginje Zorke",52 m2,2.0,III
1.300 €,"Opština Savski venac, Beograd na vodi, Hercegovačka",53 m2,2.0,XXIV
400 €,"Opština Zemun, Retenzija, Prve pruge",30 m2,1.0,V/8
500 €,"Opština Voždovac, Voždovačka crkva, Gostivarska",55 m2,2.0,I/2
850 €,"Opština Savski venac, Senjak, ",97 m2,3.0,II/2
650 €,"Opština Novi Beograd, Blok 44 (TC Piramida), ",69 m2,3.0,III/6
850 €,"Opština Zvezdara, Đeram pijaca, Marka Oreškovića",60 m2,3.5,III/5
750 €,"Opština Stari grad, Centar, Cetinjska",45 m2,2.0,III/5
800 €,"Opština Savski venac, Dedinje, Heroja Milana Tepica",55 m2,2.0,I/5
300 €,"Opština Zvezdara, Mirijevo, Učiteljice Milice Janković",34 m2,1.5,PR/3
950 €,"Opština Zvezdara, Đeram pijaca, Đuke Dinić",66 m2,3.0,I/5
550 €,"Opština Voždovac, Zaplanjska, Draginje Gavrilović",75 m2,3.0,I/2
320 €,"Opština Rakovica, Labudovo brdo, Serdar Janka Vukotića 30",42 m2,1.0,IX
800 €,"Opština Voždovac, Lekino brdo",55 m2,2.0,III/4
1.100 €,"Opština Novi Beograd, Blok 32 (Crkva svetog Dimitrija), ",90 m2,3.0,VI/6
350 €,"Opština Čukarica, Železnik, Žarka Vasiljevića",44 m2,2.5,PR/6
650 €,"Opština Novi Beograd, Blok 30 (B92), Bulevar Zorana Đinđića",41 m2,1.5,II/11
850 €,"Opština Vračar, Hram svetog Save, Dubljanska",100 m2,4.0,II/3
550 €,"Opština Stari grad, Skadarlija, Bulevar Despota Stefana",36 m2,2.0,II/6
1.300 €,"Opština Savski venac, Dedinje, Maglajska",105 m2,3.5,II/5
850 €,"Opština Savski venac, Dedinje",70 m2,2.0,I
1.100 €,"Opština Novi Beograd, Trešnjinog cveta",63 m2,2.0,II
1.950 €,"Opština Vračar, Krunski venac, Krunska",53 m2,5.0,PR
450 €,"Opština Palilula, Karaburma, Stevana Dukića-Palilula",60 m2,2.0,VI/8
400 €,"Opština Rakovica, Miljakovac, Miljakovačka",60 m2,3.0,II/2
500 €,"Opština Novi Beograd, Ledine, Valtrovićeva",54 m2,3.0,I/4
350 €,"Opština Voždovac, Centar, Irske desete divizije",36 m2,1.0,III/4
700 €,"Opština Savski venac, Beograd na vodi, Hercegovačka",35 m2,0.5,XIII/24
1.000 €,"Opština Novi Beograd, Blok 63, Nehruova",87 m2,3.0,IV/7
450 €,"Opština Novi Beograd, Arena, ",35 m2,1.0,PR/5
750 €,"Opština Novi Beograd, Blok 28, Bulevar Milutina Milankovića",60 m2,3.0,V
650 €,"Opština Stari grad, Trg Republike, Dositejeva",32 m2,1.5,IV/6
2.200 €,"Opština Savski venac, Beograd na vodi, BW Residences",92 m2,3.0,N/A
1.100 €,"Opština Savski venac, Beograd na vodi, BW Parkview",55 m2,2.0,N/A
300 €,"Opština Rakovica, Resnik, Milana Bartoša",60 m2,2.0,VPR/1
550 €,"Opština Stari grad, Dorćol, Dunavska",32 m2,0.5,I/6
650 €,"Opština Novi Beograd, Tošin bunar",53 m2,2.0,V/7
700 €,"Opština Zvezdara, Bulevar kralja Aleksandra",74 m2,3.5,I/4
450 €,"Opština Zvezdara, Dimitrija Tucovića",38 m2,1.5,N/A
